themeCode,themeName,stockCode,stockName,info
184,수자원(양적/질적 개선),A317870,엔바이오니아,"정수기용 최종필터 등 습식공정 기반의 첨단 복합소재 제조업체. 습식(Wet-laid) 제조공정에 기반을 둔 첨단부직포(Non-woven) 제조기술을 기반으로 양전하부가 고성능 정수용 나노필터(가정용, 산업용 등) 생산."
185,정유,A096770,SK이노베이션,SK그룹 계열의 종합에너지기업으로 100% 자회사인 SK에너지를 통해 정유사업을 영위. 국내 정유업계 시장점유율 1위를 기록중.
185,정유,A078930,GS,정유업체 GS칼텍스㈜를 손자회사로 보유.
187,핵융합에너지,A068240,다원시스,"특수전원장치사업(핵융합전원장치, 플라즈마전원장치, 태양광CVD전원장치 등)과 전자유도가열사업(전자유도가열장치), 철도사업 등을 주요 사업으로 영위하는 업체. 특히, 핵융합전원장치는 국가핵융합연구소 주도로 추진하고 있는 KSTAR사업과 국제핵융합실험로(ITER) 공동개발사업에 공급."
187,핵융합에너지,A056190,에스에프에이,자동화설비전문업체로 공정장비 사업부문에서 첨단에너지산업의 핵융합설비 및 가속장치 생산.
187,핵융합에너지,A094820,일진파워,핵융합 핵심 원료인 삼중수소 취급 기술 보유.
187,핵융합에너지,A002240,고려제강,"와이어로프, 경강선, PC 강선 및 강연선, 비드와이어 등 각종 선재 제조 및 판매업체. 차세대 핵융합장치에 사용되는 첨단 초전도선재 개발."
187,핵융합에너지,A042370,비츠로테크,플라즈마기술을 이용하여 핵융합반응을 일으켜 핵융합에너지를 얻는 KSTAR프로젝트사업에 참여. 초고온의 플라즈마로부터 토카막 내부의 장치를보호하는 PFC 등을 제작.
187,핵융합에너지,A001820,삼화콘덴서,국내 유일의 콘덴서 종합 메이커로 핵융합 관련 핵심부품(전력의 역류를 방지해 효율화를 극대화 시키는 SVC시스템) 생산.
187,핵융합에너지,A034020,두산중공업,국제핵융합실험로(ITER)와 한국형 초전도 핵융합 연구장치(KSTAR) 부품 생산에 참여.
187,핵융합에너지,A250060,모비스,"거대과학시설(Big Science) 분야에서 국내 기업으로는 유일하게 EPICS 기반 초정밀 특수제어 시스템 및 장비 공급. 핵융합 사업(CFS, CIS, MCS-CPSS 등) 등을 주요 사업으로 영위. 2012년 9월 국내 최초로 국제핵융합실험로(ITER) 중앙제어시스템을 수주한 바 있음."
188,풍력에너지,A018000,유니슨,"풍력발전 사업을 주된사업으로 영위. 대규모 풍력발전단지 조성 및 운영, 유지보수사업을 영위중."
188,풍력에너지,A044490,태웅,"풍력산업에 사용되는 단조부품을 생산. 풍력발전용 Main Shaft, Tower Flange 등을 생산하여 세계 전문풍력업체에 납품중."
188,풍력에너지,A053660,현진소재,"선박엔진부품 및 풍력발전부품, 운반기계, 산업용 기계 등에 사용되는 단조제품 제조업체. 주요 제품은 선박엔진 부품인 Connecting Rod와 풍력엔진용 Main Shaft 등."
188,풍력에너지,A013810,스페코,멕시코에 풍력발전용 Tower 생산공장을 건설해 윈드타워를 생산/판매중.
188,풍력에너지,A004800,효성,"태백풍력발전과 평창풍력발전을 자회사로 보유하고 있으며, 인적분할된 계열사 효성중공업(주)이 풍력발전기 사업 등을 영위."
188,풍력에너지,A119500,포메탈,"종합단조정밀기계부품 생산 업체. 풍력발전기의 핵심부품인 요(YAW) 및 피치 기어박스의 RV GEAR, HOLD FLANGE, SHAFT, 목 부위와 날개부위의 베어링 케이스인 RING 단조품을 생산."
188,풍력에너지,A054540,삼영엠텍,"선박용 내연기관구조재, 구조물/산업기계 구조재, 풍력부품 등을 생산, 판매하는 주강 전문 생산업체. 풍력부품으로는 기어박스에 들어가는 가속부품인 주강품 플래닛 케리어(Planet Carrier)를 생산."
188,풍력에너지,A101170,우림기계,"산업용감속기 및 트랜스미션 생산업체로 풍력발전기 부품도 생산/판매. 풍력발전기 3MW급 풍력발전기용 증속기 부품, MW급 풍력발전기용 YAW 감속기, 해상풍력용 감속기 등을 개발."
188,풍력에너지,A071970,STX중공업,2MW급 풍력발전기용 HUB개발.
188,풍력에너지,A100090,삼강엠앤티,"해상용 풍력발전기 지지장치를 개발했으며, 두산중공업으로부터 해상풍력발전기의 하부구조물 부품인 자켓(JAKET)을 수주한 바 있음."
188,풍력에너지,A006260,LS,"자회사 LS전선이 국내 최초로 풍력발전용 전선과 풍력발전 모니터링시스템을 개발. 또한, LS엠트론은 풍력발전설비 등에 사용되는 차세대 에너지 저장장치인 울트라커패시터(UC)를 개발."
188,풍력에너지,A024880,케이피에프,"풍력발전용 설비에 사용되는 화스너 제품(볼트, 너트 등)을 생산."
188,풍력에너지,A100660,서암기계공업,공작기계 핵심 요소부품인 각종 기어류 제조 업체. 풍력발전기용 기어를 일본에 국한하여 판매중임.
188,풍력에너지,A112610,씨에스윈드,"풍력발전기의 기둥 부분인 타워를 전문적으로 생산하는 업체. 베트남, 중국, 캐나다, 영국 및 말레이시아에 생산법인을 설립하여 풍력타워를 생산. 연간 풍력타워 생산능력 기준으로 세계 1위이며, 글로벌 풍력타워 시장에서 높은 시장점유율을 차지."
188,풍력에너지,A005160,동국산업,"동국산업 계열의 실질적 지주회사로 동국S&C의 최대주주. 자회사를 통해 윈드타워(동국S&C), 풍력발전(신안풍력발전) 등의 신재생에너지사업을 영위."
188,풍력에너지,A210980,SK디앤디,"신재생에너지 개발사업 영위. 태양광발전소 및 풍력발전소의 개발, 운영 및 발전사업관리 등의 기능 수행. 제주 가시리 풍력발전소 보유."
188,풍력에너지,A068790,DMS,"김천풍력발전(주), 보성풍력발전(주) 등 종속회사를 통해 풍력발전 시공사업을 영위."
188,풍력에너지,A009540,한국조선해양,"그린에너지 사업(태양광, 풍력 등)을 현대에너지솔루션(구,현대중공업그린에너지)로 독립시켜 종속회사로 보유. 풍력발전사업을 주요사업으로 하는 태백풍력발전, 창죽풍력발전, 태백귀네미풍력발전 등을 계열사로 보유."
188,풍력에너지,A034020,두산중공업,"3MW급 풍력 발전 시스템인 WinDS 3000™을 개발했으며, 국내업체 최초로 국제 형식인증(DEWI-OCC Type Certificate) 취득. 30MW 규모의 국내 최초 해상풍력단지 건설 외 국내외 다수 프로젝트에 공급."
188,풍력에너지,A298040,효성중공업,풍력발전의 핵심 부품인 증속기(gearbox)와 발전기(generator) 부문에서 검증된 설계 기술과 생산 역량을 갖춤.
188,풍력에너지,A297090,씨에스베어링,씨에스윈드 계열의 풍력발전 베어링 전문업체. 블레이드와 로터를 연결하고 지지하는 역할을 하는 풍력용 피치 베어링과 수평축 풍력 발전기의 요 시스템 중 중요한 요소 중 하나인 요 베어링을 주력 제품으로 생산.
19,황사/미세먼지,A045520,크린앤사이언스,"각종 여과지 및 필터(공기청정기용 필터, 공조기용 필터, 에어컨 필터 등) 등을 생산, 판매하는 업체."
19,황사/미세먼지,A119650,KC코트렐,"분진처리설비(공장 등의 집진처리장치), GAS처리설비(공장 등의 유해가스처리장치) 등 환경오염방지사업을 영위하는 업체. 주로 발전소 및 공장 등 대형 집진기를 생산 및 판매중이며, 중소형 규모 관련 기술도 보유."
19,황사/미세먼지,A044340,위닉스,"생활가전 제품인 제습기, 공기청정기, 정수기, 에어워셔, 의류건조기 등을 제조/판매."
19,황사/미세먼지,A080470,성창오토텍,"차량용 Cabin Filter (차량용에어컨필터) 등과 같은 자동차공조부품 및 공기청정기, 이온발생기 생산/판매업체."
19,황사/미세먼지,A021240,코웨이,"공기청정기(AP-1019C, AP-1019D 등) 렌탈 및 판매 사업 영위."
19,황사/미세먼지,A065950,웰크론,극세사를 이용한 청소용품 및 마스크 등을 생산.
19,황사/미세먼지,A083550,케이엠,미세먼지 흡입차단 마스크 Dr.Puri 등을 생산.
19,황사/미세먼지,A065510,휴비츠,"안과 의료기기 전문업체. 안과 및 안경점용 필수 진단기기인 자동 검안기, 자동 렌즈미터, 근접 시력 진단기, 디지털리프렉터, 챠트 프로젝터, 리프렉션 테이블, 세극등현미경 등을 개발/생산/판매중."
19,황사/미세먼지,A000520,삼일제약,"전문의약품 제조 업체. 리프레쉬플러스점안액0.5%, 히아박점안액 등 안과용제 판매."
19,황사/미세먼지,A001540,안국약품,"중소형 제약업체로 호흡기용제 클리오시럽, 시네츄라시럽 등을 생산."
19,황사/미세먼지,A045060,오공,"접착제(친환경접착제, 기능성접착제 등) 전문 제조업체. 계열사인 오공티에스 및 대형할인마트를 통해 마스크 등의 산업용 소모품 판매."
19,황사/미세먼지,A012690,모나리자,2016년 식약처로부터 황사용 마스크로 허가 받은 “스마일 황사미세먼지마스크”를 출시하여 판매중.
19,황사/미세먼지,A187790,나노,"대기 중의 오염물질인 질소산화물(NOx, Nitrogen Oxides)을 촉매를 이용해 제거하는 질소 산화물 제거(De-NOx) 기반 사업 영위 업체. 독자적인 SCR 촉매 개발 기술을 토대로 SCR 촉매 시장에서 원재료 생산부터 촉매 제조까지 VALUE CHAIN을 구축해 사업을 영위중."
19,황사/미세먼지,A003850,보령제약,점안액 “뉴브이로토EX”와 인공눈물 “아쿠아차지I”를 생산/판매중인 제약업체. 미세먼지에 따른 안질환 증가로 점안액 및 인공눈물 생산업체 수혜 전망.
19,황사/미세먼지,A001060,JW중외제약,인공눈물 “프렌즈 시리즈”를 생산/판매중인 제약업체. 미세먼지에 따른 안질환 증가로 점안액 및 인공눈물 생산업체 수혜 전망.
19,황사/미세먼지,A131030,디에이치피코리아,점안제 및 안과용제 제조 전문기업. 국내 최초로 1회용 인공눈물을 자체 개발한 업체로 국내 시장을 선도. 미세먼지에 따른 안질환 증가로 점안액 및 인공눈물 생산업체 수혜 전망.
19,황사/미세먼지,A053590,한국테크놀로지,"기술엔지니어링 사업으로 과열 및 재열증기를 이용한 석탄 고품위화 설비사업, 비산먼지 제거 주머니식 컨베이어 사업, 통합 관제시스템구축사업을 영위. 미세먼지 감소(질소산화물 배출량 감소) 효과를 불러오는 친환경 석탄건조기술 보유."
19,황사/미세먼지,A071460,위니아딤채,대유위니아그룹 계열의 종합가전 업체로 공기청정기 사업 영위.
19,황사/미세먼지,A148140,비디아이,"화력발전소의 친환경 설비 등 보조기기 설비에 대한 설계 및 제작, 시공, 시운전을 주사업으로 영위하는 업체. 미세먼지를 거르는 탈황설비와 전기집진기, 석탄 취급 설비, 회처리/회정제 설비 생산을 주요 사업으로 영위."
19,황사/미세먼지,A115390,락앤락,KF94 등급의 '퓨어돔 보건용 마스크'를 출시하여 판매 중.
19,황사/미세먼지,A071840,롯데하이마트,"롯데그룹 계열의 국내 최대 가전제품 소매업체. 전자제품 판매가 계절적 요인의 영향을 크게 받는 경향이 있으며, 미세먼지가 심해지는 봄에 건조기 및 공기청정기 매출이 크게 증가하는 경향이 있음."
19,황사/미세먼지,A066130,하츠,벽산그룹 계열의 주방기기 제조/판매 업체. 세계 최초로 환기와 공기청정기 기능을 동시에 하는 환기청정기 제품(비채(AVP-500SW))을 출시하여 판매 중.
19,황사/미세먼지,A069140,누리플랜,"수증기성 백연 뿐만 아니라 유증기, 분진, 악취 등의 입자상 백연 처리가 가능한 백연저감시스템(백연제거장치)을 개발."
19,황사/미세먼지,A037070,파세코,"세계 최초로 실리콘 밀폐를 통한 냄새, 미세먼지, 담배연기 등 외부 공기의 유입을 100% 가까이 막을 수 있는 무동력 역류 방지 댐퍼 개발."
19,황사/미세먼지,A089980,상아프론테크,자체 개발한 'ePTFE멤브레인' 소재를 이용해 열기에 잘 견디고 통기가 잘되는 고효율 필터를 제조. 2019년 초 글로벌 필터 상위업체 알스트롬뭉쇼와 3년간 멤브레인 필터를 공급하는 계약 체결
19,황사/미세먼지,A217480,에스디생명공학,KF94의 SD 더조은 황사방역용 마스크를 판매중.
19,황사/미세먼지,A002720,국제약품,KF94 및 KF80 맑은숨 황사 방역용 마스크 생산 및 판매.
191,태양광에너지,A010060,OCI,"태양전지의 핵심소재로 사용되는 폴리실리콘 생산. 또한, 초고순도 폴리실리콘의 세계적으로 몇 안되는 원천기술 보유."
191,태양광에너지,A080000,에스엔유,"OLED, LCD, 태양전지 등의 산업용 제조장비 제조/판매 업체. 세계 주요 디스플레이 제조사 및 태양전지 제조사들을 주요 고객으로 하고 있음."
191,태양광에너지,A068240,다원시스,"특수전원장치사업과 전자유도가열사업, 철도사업 등을 주요 사업으로 영위하는 업체로 태양광 폴리실리콘 제조용 CVD 전원장치(폴리실리콘 증착공정 제어) 생산."
191,태양광에너지,A056190,에스에프에이,"태양광사업분야에 진출, 차세대 기술이라 할 수 있는 박막형 쏠라셀 제조에 필수적으로 사용되는 TCO Sputter 및 CIGS Sputter를 국책과제로 성공리에 개발 완료."
191,태양광에너지,A042700,한미반도체,"반도체 자동화장비의 제조 및 판매업 등을 영위할 목적으로 설립. 반도체 제조용 장비를 자체적으로 개발, 국내외 반도체 관련 제조업체에 공급중. 이 외에 레이저장비, 태양광장비, LED장비 등도 개발·생산. 잉곳의 외관을 측정하고 검사하는 Vision Inspection 장비 등 다양한 태양광 공정용 장비를 제조."
191,태양광에너지,A000880,한화,"한화그룹의 실질적 지주회사로 태양광 관련 사업을 영위하고 있는 에이치에스아이㈜(구, 한화큐셀㈜) 지분 보유. 2012년 자회사를 통해 독일의 세계적인 태양광업체인 큐셀(Q-Cells)을 인수."
191,태양광에너지,A121600,나노신소재,"박막태양전지에 들어가는 나노소재(인듐계산화물 TCO 타겟, 아연계산화물 TCO 타겟, Silver Paste 등)를 생산중. 박막태양전지의 Cell효율 증대를 위해  HIT Solar Cell 방식의 기술이 적용되어 양산에 적용중."
191,태양광에너지,A002380,KCC,태양전지의 핵심소재로 사용되는 폴리실리콘 사업 영위.
191,태양광에너지,A079370,제우스,"태양전지 제조 장비(Tabbing System, Laminator System, Glass Loader 등) 생산업체."
191,태양광에너지,A078600,대주전자재료,"전자부품용 소재 전문제조업체로 태양전지 전극재료(전면전극 용도의 Ag 파우더, 후면전극 용도의 Ag 페이스트와 Al 페이스트) 생산."
191,태양광에너지,A083310,엘오티베큠,"반도체, 디스플레이(LCD, OLED), 태양광 셀 제조, 철강 및 일반산업 등에 사용되는 Fore Vacuum용 건식진공펌프 생산, 판매 업체."
191,태양광에너지,A009540,한국조선해양,"그린에너지 사업(태양광, 풍력 등)을 현대에너지솔루션(구,현대중공업그린에너지)로 독립시켜 종속회사로 보유. 현대중공업그린에너지는 태양광 셀, 모듈 등을 제조."
191,태양광에너지,A011790,SKC,"Industry소재사업(舊 필름사업)을 통해 태양전지용 PET필름, EVA시트 등을 생산."
191,태양광에너지,A011930,신성이엔지,태양광 사업 부문에서 태양광 제품을 생산하여 판매하는 사업과 직접 태양광 발전시스템 및 ESS를 설치하는 사업을 영위.
191,태양광에너지,A095610,테스,"태양전지용 장비제조 사업(PECVD장비 개발, 제조 등) 영위. 차세대 고효율 태양전지용 증착장비, CIGS 박막 태양전지용 증착장비, 태양전지용 Total R&D Solution 등의 연구과제 수행."
191,태양광에너지,A036490,SK머티리얼즈,"SK그룹 계열사로 반도체, 디스플레이, 태양전지 제조 과정에 사용되는 특수가스(NF3, SiH4, WF6 등) 제조/생산 전문업체."
191,태양광에너지,A036930,주성엔지니어링,"박막형(Thin film Si) 태양전지(단접합(Single)/다중접합(Tandem)), 결정형(c-Si) 태양전지, 고효율 태양전지 장비 등의 태양전지 장비 사업을 영위."
191,태양광에너지,A043200,파루,"신재생에너지사업(태양광사업), LED조명사업, 위생환경사업(온습도조절기, 무인방제기, 소독기,자동릴, 병해충방제기 등)을 영위하는 업체. 태양광추적장치가 매출의 대부분을 차지."
191,태양광에너지,A064760,티씨케이,"태양광 웨이퍼(실리콘웨이퍼)의 제조공정에 사용되는 장비의 부분품 생산. 구체적인 제품으로 태양전지용 실리콘 잉곳을 생산하는 Growing 장비용 고순도 흑연 제품을 국내 최초로 국산화하여 제조, 판매."
191,태양광에너지,A083930,아바코,평판디스플레이 관련 장비업체로 박막형 태양전지 장비 사업도 영위.
191,태양광에너지,A012340,뉴인텍,태양광 인버터용 캐패시터(콘덴서) 생산. 독일의 합작사인 카코뉴에너지를 통해 세계시장에 판매중.
191,태양광에너지,A009830,한화솔루션,"세계수준의 기술력과 사업규모를 갖춘 한화그룹 계열의 종합화학 기업. 2014년부터 태양광의 핵심소재인 폴리실리콘을 상업생산중. 자동차 부품, 산업용 소재, 전자소재, 태양광소재 등을 주요 제품으로 하는 고기능성소재로 구성되어 있는 플라스틱 가공기업 한화큐셀앤드첨단소재를 흡수합병. 연결대상 종속회사로 태양전지 및 태양광 발전시설 건설 및 판매업체 에이치에스아이(주)(구, 한화큐셀(주)) 등을 보유."
191,태양광에너지,A240810,원익IPS,"반도체 증착장비 및 장치, LCD/AMOLED장비, SOLAR CELL장비 등을 제조, 판매하는 업체. SOLAR CELL 장비인 RIE Etcher 등의 설비를 생산."
191,태양광에너지,A183300,코미코,"반도체, 태양광, 디스플레이 산업부문의 정밀세정 및 특수 코팅 사업을 영위. 태양광 전지 생산공정에 투입되는 공정장비의 Tray라는 부품을 제작, 판매하고 있음."
191,태양광에너지,A003070,코오롱글로벌,"Film형 PV모듈을 이용한 건물외장형 태양광시스템 개발. 건물일체형 태양광시스템은 동사가 국내 처음으로 상업용 건물인 코오롱건설연구소에 설치한 것을 시작으로 용인구갈 하늘채 아파트, 대구달성산업단지, 원주시청사 등으로 기술 적용 확대."
191,태양광에너지,A009440,KC그린홀딩스,태양광에너지 업체 KC솔라에너지와 태양광에너지 발전설비 사업 등을 영위하는 KC코트렐을 계열사로 보유.
191,태양광에너지,A119650,KC코트렐,"가정용뿐만아니라 산업, 대형설비까지 적용가능한 태양광발전소를 기획, 설계, 시공, 운전, 유지 및 관리하는 사업을 영위중."
191,태양광에너지,A104040,대성파인텍,"신재생에너지사업부에서 태양열 온수기, 보일러, 태양광 발전설비 및 가정용 태양광, 심야전기 보일러, 심야전기 대체 히트펌프 등을 생산, 판매."
191,태양광에너지,A210980,SK디앤디,"신재생에너지 개발사업 영위. 태양광발전소 및 풍력발전소의 개발, 운영 및 발전사업관리 등의 기능 수행. 남원사랑 태양광발전소, 순천 태양광발전소 보유."
191,태양광에너지,A003010,혜인,"건설기계 및 육상용 발전기, 선박 및 산업용 엔진/발전기 수입판매 전문업체. 태양광발전사업을 영위하는 (주)혜인산업을 흡수 합병."
191,태양광에너지,A093520,매커스,"태양광발전 전문 시행사인 (주)세찬파워, 경상남도에 위치한 태양광 발전소인 (주)에스피에너지, 전라남도에 위치한 태양광 발전소인 (주)에스피솔라 등의 지분 보유."
191,태양광에너지,A039020,이건홀딩스,"건축시장의 마감재로 사용되는 시스템창호 제조, 판매, 시공 전문업체 (주)이건창호를 자회사로 보유. 이건창호는 신재생에너지를 이용한 태양광 창호를 생산/판매중이며, 건자재 일체형 태양광발전 시스템(BIPV)을 개발."
191,태양광에너지,A108230,톱텍,"태양광관련사업(태양광발전시스템, 태양광모듈판매) 영위. 태양광 모듈 제조를 주요사업으로 하는 (주)티앤솔라를 종속회사로 보유."
191,태양광에너지,A099220,SDN,"태양광사업과 엔진조선사업을 영위하는 업체. 태양광 발전사업자와 시스템 공급업체를 대상으로 태양광 발전시스템 및 태양전지판, Inverter 등을 공급."
191,태양광에너지,A066570,LG전자,"고효율 태양광 모듈과 다결정 태양광 모듈을 개발. 또한, 에어컨 실외기 상단에 태양전지 모듈을 채용해 에어컨 보조 전원으로 사용할 수 있도록 한 친환경 태양전지 하이브리드 에어컨을 출시."
191,태양광에너지,A010120,LS산전,"태양광발전시스템 사업 및 모듈/인버터, 제어기기 제조 사업영위. 태양광 등의 그린에너지 사업을 신성장동력으로 집중육성중."
191,태양광에너지,A050760,에스폴리텍,태양광 모듈용 EVA시트 국산화 개발 완료(산업자원부 과제).
191,태양광에너지,A095910,에스에너지,태양광발전시스템 및 태양전지모듈 제조업체. 국내 최초로 BIPV모듈 상업화에 성공 및 MW급 태양광 발전소를 건설.
191,태양광에너지,A004710,한솔테크닉스,태양광 모듈을 제조하는 태양광사업을 영위.
191,태양광에너지,A017040,광명전기,중전기 전문 제조업체로 태양광발전 시스템 시공 사업도 영위.
191,태양광에너지,A015760,한국전력,"美 콜로라도 30MW 태양광발전소를 운영중이며, 한국전력-LG CNS 컨소시엄이 美 괌 태양광발전 60㎿, ESS 42㎿h 사업 수주. 18년3월 美 캘리포니아 235MW 태양광발전소를 인수해 북미시장 진출 확대."
191,태양광에너지,A140670,알에스오토메이션,"로봇 모션 제어기, 드라이브 및 에너지 제어 장치와 같은 산업용 제어 솔루션을 제조, 판매하는 업체. ESS용 PCS, 태양광용 PCS, Power Stack, UPS(상품) 등을 생산."
191,태양광에너지,A109610,에스와이,"건축 외장재 패널 전문업체. 건설 기초자재 중 하나인 조립식 샌드위치패널(EPS 패널, 그라스울 패널, 우레탄 패널, 난연EPS 패널 등) 제조 및 판매를 주요 사업으로 영위. 17년9월 베트남에 300MW 규모 태양광발전사업 시행을 위한 MOA(합의각서) 체결."
191,태양광에너지,A086390,유니테스트,"태양광발전관련 전기업을 영위하는 유니솔라에너지(주) 및 유니청정에너지(주)의 지분 100%를 보유중이며, 태양광 발전 시스템(PV System)을 설치·시공할 수 있는 기술을 보유중."
191,태양광에너지,A313760,윌링스,"전력변환기술 기반의 신재생에너지(태양광에너지) 전문업체. 주요 사업분야는 태양광 전력변환장치, 태양광발전 EPC, 유도가열 인버터(유도가열 방식 전기압력밥솥에 내장되는 보드), 선박수처리용 전력변환장치 등이 있음."
191,태양광에너지,A322000,현대에너지솔루션,"현대중공업그룹 계열의 태양광업체. 태양광 모듈 판매를 주력 사업으로 영위하고 있으며, 태양광 모듈 판매 비중이 전체 매출액의 80%를 상회. 태양광 셀 사업도 영위하고 있으며, 모듈/셀 판매에서 벗어나 인버터, ESS 관련 시스템 부문의 매출 비중을 확대하고 태양광 발전소 시공(EPC) 및 유지보수(O&M) 서비스 확대 중."
191,태양광에너지,A281740,레이크머티리얼즈,"유기금속화학물 설계 및 TMA(Trimethyl Aluminium) 제조기술을 기반으로 하여 LED, 메탈로센촉매, 디스플레이, Solar, 반도체 등의 소재로 사용되는 초고순도 유기금속 화합물을 개발 및 공급 중. 국내 유일 TMA 제조 기술을 확보하고 있으며, 전세계 TMA를 제조하는 업체 중 LED, 반도체, Solar, 촉매 사업을 전부 영위할수 있는 회사는 당사가 유일."
197,폐기물처리,A029960,코엔텍,"폐기물처리 전문업체. 폐기물처리(매립처리, 소각처리), 유틸리티(스팀생산 및 판매) 공급사업 등을 영위."
197,폐기물처리,A067900,와이엔텍,산업폐기물 처리를 주요 사업으로 영위. 여수산단 지역의 폐기물 처리가 주업.
