themeCode,themeName,stockCode,stockName,info
385,키오스크(KIOSK),A063570,한국전자금융,"한국신용정보(NICE)그룹 계열의 금융자동화기기(CD, ATM) 관리 서비스 전문업체. 무인자동화기기(KIOSK)를 개발하여 공급."
385,키오스크(KIOSK),A136540,윈스,종속회사인 (주)시스메이트가 무인키오스크 사업을 영위.
385,키오스크(KIOSK),A184230,SGA솔루션즈,"POS, 키오스크(KIOSK) 등 생활편의가전 및 정보 전달기기에 임베디드 운영체제(OS) 적용 및 공급 사업을 영위하는 에스지에이임베디드(주)를 종속회사로 보유."
386,수소차,A018880,한온시스템,친환경 공조기술인 하이브리드 에어컨 시스템과 대체 냉매 시스템 기술을 개발. 본사 및 고객들과의 협업을 통해 친환경차 공조시스템 생산 추진중.
386,수소차,A081000,일진다이아,"자회사인 일진복합소재가 현대차의 수소차인 넥쏘에 수소탱크를 공급중. 또한, 현대차의 수소버스용 모듈 및 탱크 공급업체로 선정."
386,수소차,A023900,풍국주정,자회사 에스디지가 산업용 수소를 취급하면서 시장에서 수소차 관련주로 부각.
386,수소차,A012340,뉴인텍,수소차에 탑재되는 인버터용 콘덴서를 생산.
386,수소차,A095190,이엠코리아,"자회사인 이엠솔루션은 수소스테이션(충전소) 사업을 영위. 제주, 광주, 전남, 대구, 창원 등 6개의 수소충전소 구축 실적을 보유."
386,수소차,A023800,인지컨트롤스,현대기아차의 주요 수소연료전지차에 3웨이 밸브 등 열관리 부품을 공급중.
386,수소차,A009320,대우부품,"우신산업 계열의 자동차전장부품 및 콘덴서(알루미늄 전해 콘덴서, 탄탈륨 콘덴서) 제조, 판매업체. 신규 사업으로 CCH(공조 제어 장치), PTC 히터를 양산중. 현대차 1차벤더를 통해 수소차에 물 공급 전기 펌프(Electronic Water Pump) 공급 중임.  EWP(Electronic Water Pump)수소차용 등을 양산."
386,수소차,A041930,동아화성,수소연료전지차(FCEV)의 고무가스켓 제조기술에 대한 특허권을 보유. 2009년 3월 연구개발(R&D)센터에 연료전지팀을 신설해 지속적으로 투자하고 있음.
386,수소차,A215360,우리산업,"전기차, 수소차에 장착되는 전기히터(PTC) 제품을 생산, 공급."
386,수소차,A013870,지엠비코리아,현대자동차 수소차에 수소연료 전지용 전동식 워터펌프(LMFC용 EWP) 공급 중.
386,수소차,A033530,세종공업,"수소압력센서를 기반으로 한 수소센서, 압력센서 및 물 관리, 수소배기시스템 등 각종 밸런스 오브 플랜트(BOP)를 공급."
386,수소차,A012330,현대모비스,"친환경자동차(하이브리드차(HEV), 플러그인하이브리드차(PHEV), 전기차(EV), 수소연료전지차(FCEV) 등)용 핵심부품 사업 영위. 2013년 3월부터 투싼ix 수소연료전지차에 대한 연료전지모듈, 구동모터, 전력제어기, 배터리시스템 등 핵심부품 양산 중."
386,수소차,A025320,시노펙스,18년7월에 종료된 국책과제 '자동차 연료전지용 과불소계 술폰산 이오노머 PTFE 강화막 국산화' 프로젝트의 주관기업으로서 국내 최초로 불소계 소재를 기반으로 한 수소차 연료전지의 강화막 개발에 성공. 19년4월 연료전지용 PTFE멤브레인 제조라인을 충남 천안지역에 확장하며 본격적인 사업화를 진행중.
386,수소차,A033290,코웰패션,"수소연료전지용 및 Hibrid자동차용 Film Capacitor, 방산전술차 모듈용 Film Capacitor를 개발."
386,수소차,A120110,코오롱인더,"수소연료전지용 강화복합 멤브레인 개발 및 연료전지 고분자 전해질막 지지체, 연료전지용 탄화수소계 PEM 개발."
386,수소차,A005380,현대차,2013년 세계 최초의 양산형 수소차 투싼ix FCEV 출시. 17년 '수소 전기 하우스'를 통해 차세대 수소전기차를 공개하고 친환경차 개발 전략을 발표. 2018년 수소전기차 'NEXO(넥쏘)' 출시.
386,수소차,A000270,기아차,2008년 미국 주요도시에서 SUV 모하비 수소연료전지차(FCEV) 시범주행을 실시.18년6월 현대/기아차가 아우디와 수소전기차 연료전지 기술 파트너십 계약 체결.
386,수소차,A126870,뉴로스,신규사업으로 수소연료전지 자동차용 공기압축기를 다년간의 연구 과정을 마치고 제품을 상용화함. 현대차 수소전기차에 공기 압축기를 납품중.
386,수소차,A053700,삼보모터스,2015년 관계회사인 코디박이 진행 중이던 수소차 연료전지 관련 기술을 이관받아 관련 연구를 진행 및 개발.
386,수소차,A011320,유니크,현대차와 공동으로 국책사업인 '고출력 고분자 전해질형 연료전지(PEMFC)시스템 실용화 기술개발' 완료. 수소제어모듈을 현대차에 독점 공급 중.
386,수소차,A085310,엔케이,"수소 및 LNG, CNG 등 특수가스 고압용기 전문 제작 업체. 수소충전소의 소비자 편리성과 수소스테이션 가격을 저감시키기 위한 87MPa급 Type3 수소스테이션용 저장용기 개발. 수소충전소 설립 추진."
386,수소차,A126880,제이엔케이히터,2013년 '300Nm3/h급 천연가스 개질 수소스테이션 개발'에 참여. 중형 규모(300Nm3/h)급 수소스테이션 개질기 설계·제작기술을 보유. 16년부터 '수소차전기차 융복합스테이션 국산화 기술개발 및 실증' 관련 국가과제를 수행중. 바이오가스 정제기술 보유 업체인 캐나다 Xebec과 비즈니스 파트너쉽을 구축해 바이오가스정제를 이용한 수소생산기술을 추가적으로 확보.
386,수소차,A144620,코오롱머티리얼,현대차가 참여한 국책과제를 통해 수소연료전지 전기차량(FCEV·Fuel Cell Electric Vehicle)의 핵심부품인 연료전지 분리막 원천기술 확보.
386,수소차,A037370,EG,15년6월 고체수소저장소재개발 관련 국책과제에 선정되어 국책과제를 수행중.
386,수소차,A900070,글로벌에스엠,"스페인법인(Industrias Gol, S.A.U)을 통해 알루미늄 단조개발이라는 과제명으로 미래 산업 전기, 수소자동차 경량화 연구개발을 진행."
386,수소차,A011230,삼화전자,친환경자동차에서 필수적인 DC-DC CONVERTER(LDC) 및 ON- Board Charger(OBC) 모듈에 적용되는 페라이트 코어를 생산 공급중. 페라이트 코어는 현대모비스와 공동 개발.
386,수소차,A080470,성창오토텍,"차량용 Cabin Filter (차량용에어컨필터), 클러스터 이오나이저(Cluster Ionizer), 인버터 (Inverter) 등과 같은 자동차공조부품 및 전기전장부품 제조 업체."
386,수소차,A009680,모토닉,"소 연료전지 차량용 레귤레이터 관련 특허권 보유하고 있으며, 현대 수소차에 충전 관련 레귤레이터와 매디폴더, 리쎕터클 제품 3가지를 납품중."
386,수소차,A066590,우수AMS,현대차 수소차 제품에 현대위아를 통해 감속기 부품 등의 제품을 공급중.
386,수소차,A078130,국일제지,수소연료전지 자동차등에 사용되는 탄소종이를 개발중.
386,수소차,A010770,평화홀딩스,자회사 평화오일씰공업이 수소연료전기자동차(FCEV)의 핵심부품인 연료전지 스택(Stack) 가스켓을 개발 완료.
386,수소차,A014910,성문전자,"콘덴서용 금속 증착 필름을 제조해 코웰패션, 삼화콘덴서 등 콘덴서 회사에 납품."
386,수소차,A000430,대원강업,현대자동차와 수소차 부품 엔드플레이트를 공동 개발해 납품중.
386,수소차,A038870,에코바이오,세계 최초로 매립가스를 활용한 상암동 수소스테이션 운영 및 유지관리중. 하수처리장에서는 혐기성 소화조의 효율개선을 통해 메탄가스 발생량을 증대시켜 에너지원으로 활용하여 수소 생산 및 수소차연료공급 사업 계획중.
386,수소차,A090080,평화산업,그룹 계열사 평화오일씰공업이 수소연료전기자동차(FCEV)의 핵심부품인 연료전지 스택(Stack) 가스켓을 개발 완료.
386,수소차,A105740,디케이락,"현대차 수소전기차에 레귤레이터와 매디폴더, 리쎄터클 등 수소 충전 관련 제품을 납품하고 있는 모토닉에 수소차용 밸브를 공급중."
386,수소차,A298040,효성중공업,"(주)효성에서 중공업 및 건설사업부문이 인적분할되어 재상장된 업체. CNG/수소/LNG 등의 가스를 공급받아 차량 연료로 필요한 압력, 온도 및 연료량에 맞춰 충전할 수 있는 가스충전소 사업을 영위."
386,수소차,A092780,동양피스톤,"자동차용 엔진피스톤을 전문적으로 제조하는 업체. 친환경차 수요 대응 및 사업다각화를 목적으로 우신공업(주)의 수소연료전지 자동차용 인클로저 및 매니폴드 블록사업 사업 인수계약을 18년11월 체결했으며, 양수 완료함. 인클로저 및 매니폴드는 넥쏘 등 현대차 수소전기차(FCEV)에 납품."
386,수소차,A234100,세원,현대차의 2차 벤더 업체로서 수소차에 필수적으로 들어가는 헤더콘덴서를 현대차에 공급중임.
386,수소차,A038880,아이에이,"연결종속회사인 (주)아이에이파워트론을 통해 수소차에 적용되는 전력반도체 및 전력모듈 사업을 영위중이며,  전력반도체와 전력모듈 제품 등을 세원의 공조시스템에 적용할 예정. 전력제어, 전력변환 관련 모듈 프로젝트 개발을 진행중."
386,수소차,A288620,에스퓨얼셀,"수소 연료전지시스템 제조 및 판매업체. 주요제품으로는 1kW, 5kW, 6kW, 10kW급 건물용 연료전지와 100kW급 발전용 연료 전지 등. 정부의 수소차 로드맵 발표 등으로 시장에서 관련주로 부각."
386,수소차,A110990,디아이티,현대차에 수소연료전지 검사장비 공급중.
386,수소차,A095910,에스에너지,"자회사 에스퓨얼셀이 수소 연료전지시스템 제조 및 판매사업 영위. 에스퓨얼셀의 주요제품으로는 1kW, 5kW, 6kW, 10kW급 건물용 연료전지와 100kW급 발전용 연료 전지 등. 정부의 수소차 로드맵 발표 등으로 시장에서 관련주로 부각."
386,수소차,A104830,원익머트리얼즈,차세대 수소 연료 및 수소전기차량 적용되는 NH3 개질 수소 발생 시스템 개발 완료.
386,수소차,A013570,디와이,자회사 디와이오토가 국책과제로 수소연료전지 자동차를 위한 1.2kW 고전압 BLDC 쿨링 팬 모터 및 일체형 모터 드라이버를 개발.
386,수소차,A265560,영화테크,스택 내 열 회수 및 냉각수 누설방지를 위한 전동식워터펌프 및 수소연료전지차용 고전압 부스터 시스템 개발 진행중.
386,수소차,A019540,일지테크,수소연료차 넥소에 DASH 외 1종 부품 납품중.
386,수소차,A122350,삼기오토모티브,알루미늄 다이캐스팅 및 가공을 통해 자동차 엔진부품과 변속기부품을 개발/생산 업체. 현대자동차의 수소전기차 '넥쏘'에 들어가는 모터써포트브라켓(BRKT MOTOR MTG SUPT)을 독점 공급중.
386,수소차,A071970,STX중공업,한국에너지기술평가원의 2018년 하반기 에너지기술개발사업인 'kw급 건물용 고체산화물 연료전지(SOFC) 실용화 기술 개발' 사업자에 최종 선정.
386,수소차,A059090,미코,"수소를 이용한 고체산화물 연료전지 분야의 기술 경쟁력 확보. 연료전지의 셀, 스택 시스템을 자체 제작 가능."
386,수소차,A336260,두산퓨얼셀,"건물 및 주택, 발전용 연료전지 원천기술을 보유한 친환경 에너지 설비 제조 기업. 국내에서 유일하게 발전용 연료전지로 PAFC(저온 인산형 타입의 연료전지) 타입을 활용. 정부의 수소경제 표준화 전략 로드맵 등으로 시장에서 관련주로 부각."
387,블록체인,A018260,삼성에스디에스,2016년 글로벌 블록체인 오픈소스 개발 컨소시엄에 참여하는 등 블록체인을 접목한 신규 사업 추진 강화중. 기업용 블록체인 플랫폼 '넥스레저' 및 블록체인 신분증 등을 비롯해 은행 공동 블록체인 인증 시스템인 뱅크사인(BankSign)을 개발.
387,블록체인,A039420,케이엘넷,17년5월에 발족한 삼성SDS 해운물류 블록체인 컨소시엄에 참여.
387,블록체인,A041460,한국전자인증,서울대학교 분산 컴퓨팅랩과 함께 블록체인 연구개발(R&D) 사업자로 선정.
387,블록체인,A141020,포티스,"17년7월 블록체인 기술전문 업체인 코인플러그와 동남아시아지역에 블록체인 기반 오픈페이먼트 솔루션 적용을 위한 공동 사업협약 체결했으며, 블록체인 등 플랫폼 사업 강화를 추진중."
387,블록체인,A950110,SBI핀테크솔루션즈,리플 네트워크(Ripple Network)를 활용하여 블록체인 기반의 일본-태국간 국제 송금 서비스를 개시. 국내에서도 블록체인을 활용한 국제 송금 서비스 제공중.
387,블록체인,A030200,KT,블록체인 기술을 활용한 전자서명 이미지(Electronic data & Signature Capture)관리 시스템을 개발. 18년 조직개편을 통해 5G와 블록체인 전담조직을 신설.
387,블록체인,A150900,파수닷컴,블록체인 기반의 진본 증명 플랫폼인 '파수블록(Fasoo Block)'을 개발하여 제공 중.
387,블록체인,A003550,LG,자회사인 LG CNS가 금융 블록체인 컨소시엄인 R3와 사업 협약을 체결하여 LG CNS 블록체인 플랫폼을 출시.
387,블록체인,A034730,SK,자회사인 SK C&C가 기업 범용 블록체인 디지털 서비스 및 국내 선사 대상 블록체인 기반 물류 서비스 개발.
387,블록체인,A184230,SGA솔루션즈,국내 최초 비트코인 보안 기술 개발 업체로 블록체인 인증 및 위변조 방지 기술 보유. 삼성SDS를 통해 은행연합회가 추진 중인 ‘은행 공동 블록체인 인증 시스템 구축 사업’에 참여. 18년4월 암호 기반 인증 및 전자사업 사업부문을 분할하여 블록체인 전문기업인 SGA블록체인(주)을 설립.
387,블록체인,A203650,드림시큐리티,삼성SDS와 전국은행연합회에서 추진 중인 18개 은행 공동 ‘블록체인 인증시스템 구축 사업’에 공동 참여.
387,블록체인,A027830,대성창투,삼성SDS와 공동으로 블록체인 업체인 블로코에 투자를 단행한 것으로 알려지면서 시장에서 부각.
387,블록체인,A068940,아이씨케이,자사 보유 블록체인 기술을 활용하여 금융 거래에 대한 중개 시스템인 TSM(Trusted Service Management)시스템 구축 계획.
387,블록체인,A047080,한빛소프트,"18년4월 동사의 글로벌 게임 자산 거래 블록체인 플랫폼 ‘브릴라이트(Bryllite)’ ICO 홈페이지를 정식 오픈했으며, 18년10월 글로벌 암호화폐거래소 비트포렉스에 상장."
387,블록체인,A054920,한컴위드,"17년10월 현대페이와 블록체인 기반 플랫폼 및 서비스 개발을 위한 업무협약 체결. 18년3월 기존에 보유한 통합 키(Key) 관리, 공개키기반구조(PKI), 파이도(FIDO) 생체인증, 통합인증 등의 보안 솔루션에 블록체인 기술을 적용해 보안성을 강화한 '블록체인 시큐리티 스위트(Blockchain Security Suite)' 출시."
387,블록체인,A053350,이니텍,"KT와 블록체인 기반의 통합인증, 권한관리 솔루션 공동개발."
387,블록체인,A139050,데일리블록체인,옐로모바일이 블록체인 사업 강화를 위해 동사를 인수. 18년5월 블록체인 기술 기업 및 ICO 추진 글로벌 기업 투자를 목적으로 (주)데일리크립토IB를 설립.
387,블록체인,A131090,시큐브,Secure OS 및 커널레벨 암호화 기술을 토대로 독창적인 블록체인 보안 기술 개발.
387,블록체인,A085910,네오티스,2018년1월 계열사인 유니포인트가 한국예탁결제원 전자투표업무에 블록체인 기술 적용을 위한 개념검증(PoC) 사업을 완료.
387,블록체인,A044380,주연테크,블록체인을 기반으로 복잡한 연산 처리가 가능한 신제품 '크립토(Crypto) PC'와 가정에서 블록체인 암호화 해독 체험을 해볼 수 있는 '홈 크립토(Home Crypto) PC'를 출시.
387,블록체인,A192250,케이사인,매쉬형 블록체인 기반 기술 개발. 17년 이더리움 블록체인 기반의 기기간 상호인증 기술 개발을 완료. 암호화폐 전자지갑 '터치엑스월렛(TouchxWallet)'을 개발.
387,블록체인,A000700,유수홀딩스,자회사 싸이버로지텍이 삼성SDS와 총 38개 민관연으로 결성된 해운물류 블록체인 컨소시엄에 참여.
387,블록체인,A042510,라온시큐어,"모바일, 유비쿼터스 및 기기인증 보안 솔루션을 보유한 전문 보안 솔루션 개발 업체. 18년2월 블록체인 전문기업 더루프와 블록체인 기반 생체인증(FIDO) 시스템 공동개발을 위한 업무협약 체결."
387,블록체인,A017670,SK텔레콤,18년1월 신사업부로 블록체인사업개발유닛(블록체인유닛)을 신규 설립.
387,블록체인,A035420,NAVER,18년4월 자회사 라인의 국내 법인인 라인플러스가 블록체인 기술 전문 자회사 '언블락'을 출범.
387,블록체인,A035720,카카오,"18년3월 블록체인 기술 및 서비스 자회사 '그라운드X' 설립했으며, 19년6월 그라운드X가 블록체인 플랫폼 '클레이튼'의 메인넷을 정식 출시."
387,블록체인,A286940,롯데정보통신,"롯데그룹 계열의 SM(System Management) 및 SI(System Integration) 전문 업체. AI, 빅데이터, 블록체인, IoT, 클라우드 컴퓨팅 등 4차 산업혁명, 디지털 트랜스포메이션 관련분야 신사업 추진중. 블록체인 담당을 별도로 신설하여 개발된 솔루션의 블록체인을 통한 암호화 기술 연구."
387,블록체인,A038160,팍스넷,블록체인 신사업 추진을 위해 18년7월 자회사 (주)비트팍스를 설립. 블록체인 기반 탈중앙화 방식 메신저 '쉬(Shh)' 서비스 개발.
388,아이폰,A011070,LG이노텍,"아이폰X에 사용되는 RFPCB 및 듀얼카메라 모듈, 무선충전 모듈, 3D 센싱 모듈 생산."
388,아이폰,A006400,삼성SDI,아이폰8에 OLED의 소재 중 하나인 녹색인광 재료 및 아이폰X에 소형배터리 공급. 아이폰X에 OLED를 공급하는 삼성디스플레이 지분 보유.
388,아이폰,A051370,인터플렉스,삼성디스플레이에 OLED 디스플레이용 FPCB 및 터치스크린패널(TSP)용 경연성인쇄회로기판(RF-PCB) 납품에 따른 수혜 전망.
388,아이폰,A009150,삼성전기,아이폰에 적층세라믹콘덴서(MLCC) 등 공급.
388,아이폰,A090460,비에이치,삼성디스플레이에 OLED FPCB를 공급하는 메인벤더.
388,아이폰,A272290,이녹스첨단소재,"PSPI, 봉지재, Back Plate, Back Plate 보호필름 등 다양한 아이폰 OLED 패널 소재를 개발 및 공급."
388,아이폰,A126700,하이비젼시스템,"아이폰의 듀얼카메라,3D 센싱 카메라 탑재로 인해 카메라 관련주로 부각."
388,아이폰,A034220,LG디스플레이,현재 아이폰용 LCD 패널 공급중. 아이폰에 공급할 플렉시블 유기발광다이오드(OLED) 제 2 공급사로 확정. 애플로부터 아이폰 신제품에 탑재될 6세대 플렉시블 OLED 품질 기준을 통과.
388,아이폰,A192440,슈피겐코리아,"아이폰용 휴대폰 케이스, 보호필름 등 아이폰용 악세서리 판매."
388,아이폰,A097780,에스맥,일본 닛샤프린팅과 협업 프로젝트를 통해 아이폰 시리즈에 터치스크린패널(TSP) 공급.
388,아이폰,A051910,LG화학,아이폰X에 배터리 공급중.
388,아이폰,A053610,프로텍,아이폰용 반도체 전자파간섭(EMI) 차폐 공정 장비를 SK하이닉스에 납품.
388,아이폰,A004710,한솔테크닉스,"무선충전 밸류체인 보유. 아이폰X가 무선충전기능을 탑재했으며, 글로벌핸드셋 업체들의 무선충전 기능 탑재로 수혜 전망."
388,아이폰,A005930,삼성전자,자회사인 삼성디스플레이가 아이폰X에 곡면 유기발광다이오드(OLED) 디스플레이를 공급.
388,아이폰,A263600,덕우전자,"스마트폰 카메라모듈에 장착되어 이물, 손상 방지 및 전자파 차폐기능 등을 담당하는 Stiffener를 주요 제품으로 생산. 아울러, 듀얼카메라의 앞면부에 장착하는 Bracket류도 생산. LG이노텍, 샤프 등을 통해 애플에 관련 제품을 공급."
388,아이폰,A251370,와이엠티,"FPCB 업체들에 화학소재 제품을 공급하는 2차 후방 기업으로 인터플렉스, 삼성전기, 비에이치 등에 부품을 납품."
388,아이폰,A000660,SK하이닉스,아이폰에 반도체 메모리 공급중. 아이폰X에 듀얼 렌즈 및 3D Sensing 기술 적용 등에 따른 3D NAND 탑재량 증가 전망.
388,아이폰,A000670,영풍,RFPCB(경연성인쇄회로기판)을 삼성디스플레이에 납품하는 인터플렉스와 영풍전자를 계열사로 보유.
388,아이폰,A108320,실리콘웍스,아이폰에 탑재될 6세대 플렉시블 OLED 품질 기준 통과한 LG디스플레이에 구동칩 공급.
388,아이폰,A238090,앤디포스,2015년부터 아이폰 시리즈에 방수/방진용 테이프를 납품중.
388,아이폰,A089140,넥스턴,"스마트폰 커버 유리를 구부려 엣지 글래스를 만드는 유리 열성형 장비 사업을 진행중이며, 아이폰X에 사용되는 커버 글라스/케이싱 등을 생산."
388,아이폰,A213420,덕산네오룩스,"OLED 소재사업을 담당하며, 아이폰에 OLED를 공급하는 삼성디스플레이에 OLED 소재 공급중."
388,아이폰,A084850,아이티엠반도체,NICE그룹 계열의 2차전지 보호회로 전문 업체. 애플의 에어팟 프로용 배터리의 보호회로를 단독 공급하는 사실이 시장에서 부각.
389,면역항암제,A052020,에스티큐브,"美 현지법인인 STCube Pharmaceuticals, Inc.를 통해 바이오제약부문 항암체료제 개발 및  기술이전사업을 영위. 면역관문억제제 관련 CTLA-4, PD-1, LAG-3, PD-L1 등의 파이프라인을 보유. 또한, 개발한 PD-L1항체에 항암제를 부착하여 만든 항체약물결합체 PD-L1-ADC 파이프라인도 보유. 면역관문억제 단백질 ""PD-L1"" 항체에 대한 中 라이선스 계약을 진행한 바 있음."
389,면역항암제,A215600,신라젠,"차세대 항암치료제 연구, 개발 및 제조업체. 면역항암제 펙사벡(Pexa-Vec) 글로벌 임상 3상 진행중. 펙사벡과 면역관문억제제의 병용치료법 개발 및 적응증 확대, 차세대 항암 바이러스의 개발도 진행중."
389,면역항암제,A224060,코디엠,차세대 면역 항암제 CAR-T 개발중인 美 기업 페프로민바이오 지분 보유.
389,면역항암제,A095700,제넥신,면역 시스템의 핵심세포인 T세포를 만들어내는 가장 중요한 단백질인 인터루킨-7(interleukin-7)을 이용한 항암 면역치료제(GX-I7) 개발 진행중.
389,면역항암제,A115180,큐리언트,"면역항암/내성암 치료제 Q702 프로그램은 독일 막스플랑크연구소 및 리드 디스커버리 센터에서 선도 물질을 기술 도입하여 최적화, 후보물질 선정, 광범위 특허권 확보를 진행하였으며 비임상 개발 중임."
389,면역항암제,A086890,이수앱지스,면역항암 치료제 옵디보의 바이오시밀러 'ISU106' 개발 진행중.
389,면역항암제,A144510,녹십자랩셀,녹십자그룹 계열의 바이오업체. NK면역세포치료제를 연구개발하는 것을 주요사업으로 영위. 면역원성 제거된 NK 세포에 CAR 유전자 도입으로 CAR-NK 개발 진행중.
389,면역항암제,A182400,엔케이맥스,"관계사 엔케이맥스가 슈퍼NK 면역항암치료 기술 개발. 한국, 미국, 중국에 이어 전세계 60여개국에 특허협력조약(PCT) 국제 출원을 완료한 상태. 명지병원-에이티젠그룹, 면역세포치료제 공동 연구 협약(18년12월)."
389,면역항암제,A000100,유한양행,에이비엘바이오(주)와 면역항암제(이중항체) 2종 라이선스 인 계약 체결. 자회사 이뮨온시아가 면역항암제 'IMC-001' 개발 진행중.
389,면역항암제,A170900,동아에스티,美 애브비 바이오테크놀로지에 면역항암제 신약 후보물질 기술수출.
389,면역항암제,A001540,안국약품,2016년9월 와이바이오로직스로부터 면역항암치료제 도입 계약 체결. 면역항암제 AG-B1622 등을 파이프라인으로 보유.
389,면역항암제,A085660,차바이오텍,美 바이오 기업 소렌토와 항암 면역세포치료제 개발을 목적으로 국내에 합작사를 설립.
389,면역항암제,A084990,헬릭스미스,"Her2/neu를 과발현하는 유방암, 위암, 췌장암 등의 질환을 치료하기 위한 항암 치료 백신 'VM206' 한국 임상 1상 완료. 항암치료로 인해 발생하는 혈소판 감소증을 치료하기 위한 항암 보조 치료제 'VM501' 중국 임상3상 진행중. 미래창조과학부 주관 바이오·의료기술개발사업(암세포 특이적인 신규 CAR-T 치료제 개발) 수행(기간 16년5월~18년12월)."
