themeCode,themeName,stockCode,stockName,info
104,스마트홈(홈네트워크),A015710,코콤,"스마트 홈 시스템(IoT/홈 네트워크 시스템, 홈 오토메이션), 비디오 도어폰, 도어폰, 인터폰, CCTV시스템, LED 조명 시스템, SI사업 등을 영위하는 업체. 위례 신도시에 음성인식으로 난방, 조명, 방범 등 홈네트워크 기능을 제어하는 월 패드 공급."
104,스마트홈(홈네트워크),A038680,에스넷,"네트워크통합을 근간으로 하는 소프트네트워크 솔루션 전문업체. 네트워크 기술 기반으로 하는 스마트오토메이션 센터 서비스 출시. 다양한 애플리케이션과 연동, 네트워크 운영, 관리를 자동화 함."
104,스마트홈(홈네트워크),A042940,상지카일룸,"홈네트워크시스템 관련 특허 및 저작권을 보유하고 있으며, 유/무선상의 인터넷 망을 통하여 가정의 백색가전, 각종 센서, 액츄에이터 등을 제어ㆍ모니터링."
104,스마트홈(홈네트워크),A066570,LG전자,"스마트 씽크(ThinkQ)를 통해 휘센 에어컨, 트롬세탁기, 스마트TV, 냉장고, 공기청정기를 제어하는 서비스를 제공."
104,스마트홈(홈네트워크),A039010,현대통신,"SK하이닉스(구 하이닉스)에서 분사해 설립된 업체로 스마트홈시스템 사업 등을 영위. Smart Home, 주방TV, 무인경비시스템, 디지털도어락, CCTV류 등을 생산하고 있으며, 특히 국내 최초 무인전자 경비 시스템 개발과 디지털 도어락(Digital Door Lock)의 시장 도입."
104,스마트홈(홈네트워크),A036690,코맥스,"COMMAX라는 자체 브랜드를 보유한 홈네트워크, 비디오폰, 인터폰, CCTV, 방송설비 등의 전자통신기기 전문 제조업체. 비디오폰, 인터폰을 비롯한 홈네트워크 솔루션 부분 국내 선두권 업체."
104,스마트홈(홈네트워크),A012750,에스원,"삼성그룹 계열의 국내 1위 시스템 경비 및 통합 보안서비스 제공업체. NFC 기술을 이용하여 스마트폰 연동, 원격 방법 설정 및 긴급 출동 서비스를 제공. SK텔레콤과 제휴를 통해 ‘세콤 홈블랙박스 서비스’ 개시."
104,스마트홈(홈네트워크),A005930,삼성전자,"사물인터넷(IoT) 기능을 적용한 ‘패밀리 허브’ 냉장고 출시. ‘패밀리 허브’와 연동된 스마트폰으로 식재료 확인, 대형마트 연계 쇼핑이 가능하며, 냉장고를 이용해 라디오, TV시청, 각종 정보 확인 등이 가능."
104,스마트홈(홈네트워크),A039570,HDC아이콘트롤스,"HDC 그룹의 정보기술(IT) 핵심 계열사로, 빌딩솔루션 및 스마트홈 전문업체. 홈네트워크 시스템과 연동을 통해 주차관제, 원격검침, CCTV, 정보통신, LED조명 등의 제품 출시."
104,스마트홈(홈네트워크),A011690,유양디앤유,"LCD, LED, 3D, 스마트, OLED, UHD TV용 전원공급장치 및 LED SOLUTION의 제조/판매업체. 스마트 LED조명 제어기술 특허 보유."
104,스마트홈(홈네트워크),A009450,경동나비엔,나비엔 홈오토메이션을 통해 스마트폰으로 제어 가능한 스마트 보일러 출시.
104,스마트홈(홈네트워크),A017670,SK텔레콤,IoT 플랫폼 ‘씽플러그(ThingPlug)’ 출시. 다수의 스마트홈 관련 업체와 제휴중.
104,스마트홈(홈네트워크),A030200,KT,스마트폰을 이용해 홈캠으로 촬영된 영상을 모니터링하는 ‘올레 기가 IoT 홈캠’ 출시.
104,스마트홈(홈네트워크),A032640,LG유플러스,"ADT캡스와 제휴를 통해 ‘IoT캡스’ 출시. 핵심 홈서비스인 IPTV, IoT와 네이버 인공지능 플랫폼 '클로바'를 AI스피커에 접목시켜, 인공지능 스마트홈 서비스 'U+우리집AI'를 출시."
104,스마트홈(홈네트워크),A002230,피에스텍,"전력선통신(PLC) 방식의 디지털 원격검침시스템 생산, 판매 업체."
104,스마트홈(홈네트워크),A040160,누리텔레콤,"무선통신 솔루션 전문업체. 통신 SW 기반의 기술력을 바탕으로 IoT(사물인터넷) 기반 지능형검침 인프라(AMI) 솔루션을 주력사업으로 다양한 응용사업 즉, 스마트그리드 및 스마트그리드 확산사업, 마이크로 그리드 구축사업을 중점적으로 공급."
104,스마트홈(홈네트워크),A057540,옴니시스템,"2010년 스마트그리드 기반의 스마트홈 에너지 관리 시스템 관련 지경부 국책과제 선정됐으며, 삼성전자와 홈네트워크 관련 사업을 진행한 바 있음."
104,스마트홈(홈네트워크),A065770,CS,2012년 RS-485를 기반으로 하는 홈네트워크 시스템 등의 홈네트워크 관련 특허 출원/보유.
104,스마트홈(홈네트워크),A091440,텔레필드,"홈네트워크를 활용해 U-Care 서비스, U-Health 서비스 제공. 가스 누출·화재 감지 IoT 기술 보유."
104,스마트홈(홈네트워크),A079430,현대리바트,"터치스크린이 설치된 방문, 화장대 및 스마트폰과 연동 가능한 스마트 가구 출시."
104,스마트홈(홈네트워크),A044340,위닉스,SK텔레콤과 제휴를 통해 사물인터넷(IoT) 기능을 적용시킨 제습기 ‘위닉스뽀송3D’ 출시.
104,스마트홈(홈네트워크),A032790,엠젠플러스,스마트홈 네트워크 장비(비디오폰/카메라 도어폰 등) 사업 영위.
104,스마트홈(홈네트워크),A317400,자이에스앤디,"GS그룹 계열의 종합 부동산서비스 업체로, 건설업을 전방산업으로 하는 정보통신 사업(스마트홈 시스템 등) 등도 영위. 스마트홈 네트워크, 스마트홈 보안 관련 제품을 GS건설을 비롯하여 주요 건설사, 중소 건설사, 주택공사 등 공공기관에 납품."
105,사료,A097950,CJ제일제당,"라이신, 쓰레오닌, 트립토판, 발린, 메치오닌, 식물고단백 등 사료첨가제를 제조, 판매중. 2010년 해외사료 사업의 지주회사인 Global Holdings Ltd 를 인수함으로써 국내뿐만 아니라 인도네시아, 필리핀, 베트남, 중국, 캄보디아, 미얀마 등 총 7개국을 거점으로 국가별 상황에 맞는 사료/축산의 균형 있는 인프라를 확보. 19년7월 국내 생물자원 사업부를 물적분할해 씨제이생물자원 주식회사 신설."
105,사료,A001790,대한제당,"사료사업(가축용 배합사료, 상표명 : 무지개사료) 영위."
105,사료,A002140,고려산업,해피드(hafeed) 브랜드의 가축용 배합사료 전문업체로 식육사업도 영위.
105,사료,A002680,한탑,영남지역을 중심으로 제분사업(소맥분)과 사료사업(배합사료) 등을 영위하는 업체.
105,사료,A005860,한일사료,"양계, 양돈, 축우용 배합사료 생산업체."
105,사료,A006980,우성사료,"양돈, 양계, 축우, 양어, 애완용 등의 배합사료 제조/판매업체."
105,사료,A003310,대주산업,"동물식용 배합사료(주요 상표 : 코끼리표, 도그랑 등) 제조 및 판매업체."
105,사료,A008040,사조동아원,"사조그룹 계열사로 양계, 양돈 등의 배합사료 제조 및 판매업체."
105,사료,A025880,케이씨피드,"양계용, 양돈용, 축우용 등의 가축가금용 배합사료 제조업체. 주요 상표로 톱플러스(양계용), 한돈애(양돈용), 하누애(축우용) 등이 있음."
105,사료,A036580,팜스코,"하림그룹 계열사로 배합사료(주요상표: 팜스프로, 리더스, 메이드, 도그닥터, 피그원 등) 전문업체."
105,사료,A027710,팜스토리,이지바이오 계열사로 사료사업(배합사료 제조 및 판매) 영위.
105,사료,A035810,이지바이오,"천연제제의 동물약품, 기능성첨가제, 배합사료를 생산/판매/유통하는 업체. 글로벌 유수의 다국적기업과 국내 독점 대리점 계약을 체결해 고품질의 기능성 첨가제를 공급중. 사료제조 및 판매업체 팜스토리(구 도드람B&F)의 최대주주."
105,사료,A060590,씨티씨바이오,"미생물배양과 발효기술, 제약기술 등의 생명공학분야 전문 연구기업. 단미보조 사료, 사료첨가제 등을 생산/판매 중."
105,사료,A136490,선진,옛 선진에서 인적 분할된 배합사료 및 축산물 제조업체. 선진사료라는 상표의 배합사료 및 선진포크 브랜드의 식육제품을 생산/판매중.
105,사료,A018620,우진비앤지,사료첨가제를 생산하여 국내 사료공장 등에 납품중.
105,사료,A218150,미래생명자원,"단미사료(기능성 원료, 특수가공 원료) 및 보조사료(기능성 첨가제) 등을 생산하는 사료부문(동물자원사업부문)을 주력으로 영위. 기능성 식품(오렌지에그 등)의 제조 및 유통을 영위하는 식품유통사업(생명자원사업부문)도 영위."
105,사료,A016790,현대사료,"동물용 사료 제조업체. 배합사료(양계,양돈,오리 등) 제조판매업을 주요 사업으로 영위하고 있으며, 특히 산란계 사료부문에서 약 7.4%(2018년 기준) 점유율 차지."
106,바이오인식(생체인식),A010820,퍼스텍,"출입통제기 시스템, 얼굴인식 보안 응용 솔루션 등의 시스템사업 영위. 2003년 국내 최초로 얼굴인식 시장에 진출. 얼굴인식 출입통제 시스템인 ""Vision Gate""시리즈를 공공건물과 기업, 아파트 등에 공급. 국내에서 최초로 KISA로부터 얼굴인식 성능 인증을 받은 바 있으며, 스마트폰용 자동 얼굴 인식 모바일 앱어플리케이션, 얼굴인식 PC보안 시스템 등을 개발."
106,바이오인식(생체인식),A114120,크루셜텍,사용자의 지문을 인식해 마우스처럼 커서를 움직일 수 있도록 해주는 모바일 기기 전용 입력장치인 옵티컬 트랙패드(OTP) 및 OTP에 지문인식 기능을 추가한 바이오메트릭 트랙패드(BTP)를 주요제품으로 생산.
106,바이오인식(생체인식),A236200,슈프리마,"기존 슈프리마가 바이오인식 시스템 및 바이오인식 솔루션 사업을 분할함에 따라 재상장된 업체. 바이오인식 알고리즘, 모듈 등 각종 솔루션 제품과 바이오인식 단말기, 소프트웨어 등의 응용 시스템 사업 영위."
106,바이오인식(생체인식),A047310,파워로직스,"2차전지 보호회로 및 카메라 모듈 제조업체. 근거리용 홍채인식 카메라모듈을 개발 완료했으며, 중장거리용 홍채인식 카메라모듈 개발중."
106,바이오인식(생체인식),A111870,삼본전자,인도 생체정보 수집 프로젝트인 아드하르(Aadhaar) 프로젝트에 참여 경험 보유.
106,바이오인식(생체인식),A064800,필링크,홍채인식 기술 관련 특허권 보유.
106,바이오인식(생체인식),A076610,해성옵틱스,"렌즈 및 카메라 모듈 등 광학부품 전문업체. 홍채 인식 관련 특허권을 다수 보유하고 있으며, CES2014에서 홍채인식 카메라모듈 공개. 삼본정밀전자를 통해 인도 생체정보 수집 프로젝트인 아드하르(Aadhaar) 프로젝트에 참여 경험 보유."
106,바이오인식(생체인식),A078650,코렌,비구면 광학렌즈 설계 및 양산기술을 바탕으로 휴대폰용 카메라렌즈를 주력으로 생산하는 업체. 삼성전자 ‘갤럭시 노트7’에 홍채인식렌즈 납품.
106,바이오인식(생체인식),A042510,라온시큐어,"모바일, 유비쿼터스 및 기기인증 보안 솔루션을 보유한 전문 보안 솔루션 개발 업체. 공인인증서나 액티브엑스(ActiveX)를 설치하지 않고 비밀번호 입력도 없이 지문, 홍채, 얼굴인식 등의 생체인식이나 핀(PIN) 번호로 간편하게 본인 인증할 수 있는 바이오인증 기반 FIDO 간편인증/결제 기술 개발."
106,바이오인식(생체인식),A097520,엠씨넥스,"카메라 모듈 전문업체. 생체인식모듈(지문, 홍채, 안면)을 개발 및 생산."
106,바이오인식(생체인식),A091700,파트론,삼성전자 갤럭시노트7에 홍채인식 카메라모듈 납품. 당사의 지문인식과 홍채인식 모듈을 스마트폰에 채용중.
106,바이오인식(생체인식),A077500,유니퀘스트,계열사 드림텍이 삼성전자 스마트폰에 지문인식 관련 모듈을 공급.
106,바이오인식(생체인식),A096640,멜파스,"정전용량방식의 지문인식 칩, 솔루션 개발."
106,바이오인식(생체인식),A203450,유니온커뮤니티,"지문인식 기술을 이용한 제품 및 솔루션을 제공하는 바이오인식 전문업체. 주요 제품으로 지문인식 출입통제기, 지문 모듈 및 등록기, 카드인식 출입통제기 등이 있음. 18년7월 바이오인식 제품 개발 및 제조, 판매업체 (주)니트젠 흡수합병."
106,바이오인식(생체인식),A203650,드림시큐리티,"보안 솔루션 전문업체로 PKI기반의 정보보안, 인증솔루션, 시스템 구축 및 개인정보보호 서비스 제공 사업을 영위. 16년 공인인증서와 연계한 바이오인증솔루션과 FIDO 기반의 생체인증솔루션(Magic FIDO) 출시."
106,바이오인식(생체인식),A036810,에프에스티,"해외 20여개 주요 반도체 기업과 전략적 Partnership을 통해 국내 시장에 대한 독점/비독점적 지위를 갖고 모바일, Display, 자동차, CCTV, 동작센서, 산업용GPS 등에 Solution을 제공. 오슬람으로부터 칩을 공급 받아 홍채관련 조립회사에 공급한 바 있음(삼성전자에서 사용)."
106,바이오인식(생체인식),A094170,동운아나텍,팹리스(Fabless) 아날로그 반도체 업체. 생체인증 솔루션의 핵심 기술인 지문인식 알고리즘(Algorithm) 기술개발을 완료해 다양한 제품 적용을 위한 프로모션과 글로벌 메이커들과의 협력을 통해 시장 진입을 추진중.
106,바이오인식(생체인식),A131090,시큐브,생체수기서명 인증기술 관련 특허 취득.
106,바이오인식(생체인식),A192650,드림텍,"스마트폰용 PBA 모듈, 디스플레이 PBA 모듈, 지문인식센서모듈 등을 제조. 삼성전자의 1차 벤더임."
106,바이오인식(생체인식),A317770,슈프리마아이디,"지문등록기기 및 지문인증기기 전문업체. 바이오 정보를 등록, 인증 및 활용하는 데 필수적인 각종 디바이스와 솔루션을 자체 개발하여 생산 및 판매. Biometric Solutions(지문 등록 및 인증 스캐너 등)와 eDocument Solutions(여권판독기 등) 사업을 주 사업으로 영위하고 있으며, Digital Security Solutions(바이오전자서명 기기, 보안토큰 등)사업을 신규 사업으로 추진중."
108,"백신/진단시약/방역(신종플루, AI 등)",A072020,중앙백신,"동물백신 제조를 주요 사업으로 영위하는 업체. 동물백신을 축종에 따라 수이샷 양돈백신, 포울샷 가금백신, 캐니샷 애견백신, 보비샷 축우백신 등으로 제조 및 판매. 이와 함께 사료첨가제, 소독제 등의 일반제제 동물약품과 생물학적제제 관련 용역을 제공."
108,"백신/진단시약/방역(신종플루, AI 등)",A054670,대한뉴팜,"동물의약품(동물 치료제, 영양제, 가축용 백신제제 등) 등을 영위."
108,"백신/진단시약/방역(신종플루, AI 등)",A044960,이글벳,"동물약품 전문 제조 및 수입업체. 첨가제, 수용산제, 주사제, 액제 등 동물약품 생산/판매 사업 등을 영위. 신규사업으로 반려동물용 약품, 사료, 부외품 등을 제조 및 수입 판매."
108,"백신/진단시약/방역(신종플루, AI 등)",A006280,녹십자,"의약품에 대한 연구개발, 제조, 판매 등을 하고 있으며, 전문의약품에서부터 일반의약품에 이르기까지 폭넓은 제품 라인을 보유. 국내 최초로 AIDS진단시약을 개발하는 등 바이오의약품 분야에서 차별화된 노하우와 경쟁력을 확보중. 백신제품과 혈액관련제품이 전체 매출액의 대부분을 차지."
108,"백신/진단시약/방역(신종플루, AI 등)",A048530,인트론바이오,"다수의 국가방역기관 등과 조류독감, 돼지독감, 구제역 등의 동물용 분자진단제를 공동개발하여 공급중. 또한 여러 대기업들과 살모넬라진단, VRE 진단, 및 성매개감염 등의 진단제품을 공동개발중."
108,"백신/진단시약/방역(신종플루, AI 등)",A043200,파루,"농축산 관련 방역소독기, 천연살균탈취제(플루데이), 손세정제(플루) 등 생산."
108,"백신/진단시약/방역(신종플루, AI 등)",A005250,녹십자홀딩스,"녹십자그룹 지주회사로 녹십자, 녹십자랩셀, 녹십자엠에스 등을 자회사로 보유."
108,"백신/진단시약/방역(신종플루, AI 등)",A007570,일양약품,"충북 음성에 연간 최대 6,000만 도스(does) 생산 규모의 인플루엔자 백신공장을 준공해 본격 생산판매 돌입. 계절 독감백신을 생산/판매 중이며, 새로운 고부가치 백신으로 3,4가 플루백신, 조류독감백신 등 다양한 백신을 생산/판매하기 위해 백신사업에 지속적으로 R&D투자를 진행중."
108,"백신/진단시약/방역(신종플루, AI 등)",A064550,바이오니아,"유전자 연구개발 관련 기초 재료 및 장비생산업체. 유전자연구/분자진단용 기초 소재 및 시약, 분자진단키트, 유전자 추출/증폭/정량분석장비, 분자진단 장비 등을 개발/생산."
108,"백신/진단시약/방역(신종플루, AI 등)",A109820,진매트릭스,"유전자 분석 및 맞춤의료를 위한 분자진단 사업을 영위하는 업체. 진단, 의료기기, 천연물을 포함한 신약 및 친환경과 관련한 기술, 제품 또는 상품을 연구개발, 제조, 판매하는 사업을 영위."
108,"백신/진단시약/방역(신종플루, AI 등)",A003120,일성신약,"항생제(오구멘틴 등), 경구용단백분해효소저해제(호이판 등), 마취제(세보프레인 등), 골질환치료제(원알파) 등의 의약품 제조, 판매."
108,"백신/진단시약/방역(신종플루, AI 등)",A003850,보령제약,"의약품사업을 영위하는 제약 전문업체. 주요 제품으로 위장병, 고혈압, 위궤양 치료제 및 항생제 등의 제품과 인플루엔자 백신, 항암 치료제 및 항고지혈증제 등. 18년8월 인플루엔자 비알플루텍테트라 백신, 보령타미캡슐 개발 완료."
108,"백신/진단시약/방역(신종플루, AI 등)",A096530,씨젠,"유전자(DNA 및 RNA) 분석을 통해 질병의 원인을 감별하는 분자진단 시약 개발 제조/공급 업체. 높은 기술력으로 양대 분자진단 방법 기반의 DPO™, TOCE™, MuDT™ 등의 기술 보유. 주요 제품으로 호흡기 질환 검사제품(신종플루, 계절성 독감, 코로나 바이러스, 폐렴 원인균 등 26종 검사), 성감염증 검사 제품(임질, 매독, 클라미디아, 헤르페스, 진균 등 28종 검사), 인유두종 바이러스 검사제품(자궁경부암 원인 바이러스 28종 검사) 등이 있음."
108,"백신/진단시약/방역(신종플루, AI 등)",A011000,진원생명과학,"의류용 심지와 바이오의약품 사업을 영위하는 업체. 바이오의약품 사업은 바이오의약품 CMO사업과 플라스미드 DNA기반 신약개발사업으로 구분됨. 임상시험에 필요한 유전자치료제 및 DNA백신의 원료인 국제규격(cGMP) 플라스미드(Plasmid) DNA 제품을 미국 현지법인인 VGXI, Inc.에서 생산하여 판매하고 있으며, 유니버설 인플루엔자 예방용 DNA백신과 만성C형 간염 치료용 DNA백신을 파이프라인으로 보유."
108,"백신/진단시약/방역(신종플루, AI 등)",A060590,씨티씨바이오,"미생물배양과 발효기술, 제약기술 등의 생명공학분야 전문 연구기업. 조류인플루엔자(AI) 대상의 소독제 및 진단키트를 해외에서 수입하여 판매중."
108,"백신/진단시약/방역(신종플루, AI 등)",A014570,고려제약,"일반의약품에 지명도 있는 중소 제약업체로 주요 제품으로는 종합감기약(하벤), 항생항균제, 기타 알레르기 질환 치료제 등을 보유."
108,"백신/진단시약/방역(신종플루, AI 등)",A019170,신풍제약,"원료 자체 개발 능력을 보유한 의약품 제조, 판매 업체. 동사가 판매하고 있는 항생제에 세계 보건기구가 사스 치료제로 권고한 ""리바비린"" 성분이 포함됨."
108,"백신/진단시약/방역(신종플루, AI 등)",A024720,한국콜마홀딩스,"세포배양방식의 조류와 유행성 독감백신, 탄저균백신을 개발해 미국내 임상을 진행중인 Altimmune, Inc.社 지분 보유."
108,"백신/진단시약/방역(신종플루, AI 등)",A036480,대성미생물,"동물용 의약품 전문 제조업체로 돼지, 닭 등의 가축과 양식어류 등을 대상으로 하는 백신, 효소제, 생균제, 미생물결합 광물질제, 주사제(항균제, 영양제 등) 등의 제품을 생산."
108,"백신/진단시약/방역(신종플루, AI 등)",A041960,코미팜,"동물용 백신과 소독제(구제역, 조류인플루엔자(AI), 돼지콜레라 등), 각종 예방약인 백신제 및 치료제인 주사제, 영양제 등의 동물용 의약품 전문 제조업체."
108,"백신/진단시약/방역(신종플루, AI 등)",A043090,큐브앤컴퍼니,"의약품원료의 제조 및 판매를 주요사업으로 영위하는 업체. 타미플루의 주원료인 ""인산 오셀타미비르""를 생산하는 중간체에 대해 국제특허(PCT) 출원."
108,"백신/진단시약/방역(신종플루, AI 등)",A052670,제일바이오,"동물의약품 전문 생산업체. 발효를 기반으로 하는 동물의약품을 연구개발/제조/판매하고 있으며, 제품제형화와 일반사료첨가제 사업에 대한 연구개발 성과를 상업화 중. 닭, 돼지, 소의 기능성 사료첨가제와 치료용 주사제, 진단키트(질병진단), 백신(질병예방) 등을 생산."
108,"백신/진단시약/방역(신종플루, AI 등)",A061250,화일약품,원료의약품 제조 및 판매업체. 세팔로스포린계 항생제 제품 생산.
108,"백신/진단시약/방역(신종플루, AI 등)",A033250,체시스,"계열회사 넬바이오텍이 동물약품, 단미사료, 기능성비료, 동물약품원료 제조/도매 및 농수축산용기자재 도소매 등 동물용 의약품 제조업 영위."
108,"백신/진단시약/방역(신종플루, AI 등)",A003060,에이프로젠제약,"항생제, 순환기제, 소화기제, 소염진통제 등 140여 품목의 의약품을 생산/판매. 중동호흡기증후군(메르스) 치료 사용 항바이러스제 보유."
108,"백신/진단시약/방역(신종플루, AI 등)",A950130,엑세스바이오,"진단제품 생산 전문 업체. 체외진단 기술을 토대로 말라리아 진단시약과 에이즈(HIV) 진단용스트립(반제품) 등의 진단 제품을 개발, 제조, 판매하는 사업을 영위중."
108,"백신/진단시약/방역(신종플루, AI 등)",A185750,종근당,조류인플루엔자(AI) 치료제인 '타미플루' 원료를 독자기술로 개발.
108,"백신/진단시약/방역(신종플루, AI 등)",A000100,유한양행,스위스 로슈사로부터 조류인플루엔자(AI) 치료제인 타미플루 국내 공급자로 선정된 바 있음. 2017년 8월 스위스 다국적제약사 로슈 타미플루 국내 특허 만료 후 타미플루 '유한엔플루캡슐' 생산 및 판매중.
108,"백신/진단시약/방역(신종플루, AI 등)",A018620,우진비앤지,"동물약품 및 미생물제제(동물약품, 인체원료의약품, 미생물 농자재) 제조업체로 조류독감 예방치료제, 면역증강제 등을 생산/판매."
108,"백신/진단시약/방역(신종플루, AI 등)",A182400,엔케이맥스,실험용시약(시누클린재조합 유전자단백질항체) 제조 및 공급/판매업을 주사업으로 영위하는 업체. 세계 최초로 전혈에서의 NK 세포 활성도 측정법을 이용한 면역력 측정이 가능한 키트(체외진단분석용 기기-암 진단키트) 개발.
108,"백신/진단시약/방역(신종플루, AI 등)",A185490,아이진,"노화 관련 성인 질환의 예방 및 치료 의약품 연구개발을 주요사업으로 하는 바이오의약품 생산업체. 단백질체학과 면역학을 기반으로 하는 만성허혈질환 관련 치료기술(당뇨망막증 치료제, 욕창 치료제, 심근허혈/재관류손상치료제)과 예방 백신 관련 원천기술(자궁경부암 예방 백신, 대상포진 예방 백신, 면역보조제) 확보."
108,"백신/진단시약/방역(신종플루, AI 등)",A142760,바이오리더스,바이오신약 및 소재 개발 업체. 점막면역을 통한 생체 내 면역반응을 강화시키는 생리활성물질인 γ-PGA를 이용한 HumaMax™ Technology(의약 신소재 γ-PGA 이용 기술)와 유산균을 활용한 플랫폼 기술인 MucoMax™ Technology(경구용 점막면역 백신 개발 플렛폼 기술)를 기반으로 하여 바이오신약 개발.
108,"백신/진단시약/방역(신종플루, AI 등)",A086060,진바이오텍,자회사 (주)다원케미칼을 통해 동물질병예방치료제 및 배합사료용 첨가제 등에 적용되는 동물약품을 생산 및 판매중.
108,"백신/진단시약/방역(신종플루, AI 등)",A128940,한미약품,"의약품 제조 업체로 독감치료제 한미플루 생산, 판매 중."
