themeCode,themeName,stockCode,stockName,info
3,LCD 부품/소재,A102710,이엔에프테크놀로지,"반도체 및 디스플레이용 전자재료 전문 제조업체. TFT-LCD 소재인 프로세스케미칼(신너, 현상액, 식각액, 박리액 등), TFT-LCD의 칼라필터용 칼라페이스트 등을 제조하여 국내외 LCD 제조업체에 판매중."
3,LCD 부품/소재,A054040,한국컴퓨터,전자제품 세트 업체로부터 완제품의 생산을 위탁받아 생산하는 국내 최초의 EMS(Electronic Manufacturing Service) 전문업체. 중대형 TFT-LCD(LCD-TV용 보드) 모듈용 부품 제조하여 삼성디스플레이 등에 납품.
3,LCD 부품/소재,A104830,원익머트리얼즈,"2006년 12월 구 원익IPS의 특수가스사업부문이 물적분할한 업체. 반도체 및 디스플레이 생산공정에 사용되는 특수가스 생산을 주요 사업으로 영위. 삼성전자, SK하이닉스 등의 종합반도체회사를 주요 고객사로 두고 있으며, 반도체 이외에도 삼성디스플레이 AMOLED 사업부에 공정용 특수가스를 공급중."
3,LCD 부품/소재,A036810,에프에스티,반도체 재료/장비 전문업체. LCD용 펠리클(Pellicle) 사업도 영위.
3,LCD 부품/소재,A121850,코이즈,"LCD 보호필름 및 광학코팅 업체. LCD 보호필름 제조 및 LCD의 부품인 백라이트유닛(BLU)의 핵심소재인 광학필름의 코팅과 도광판 및 보호필름 제조를 중심으로 사업 영위. 주요매출처는 LG전자, 미래나노텍, LGD, BOE 등임."
3,LCD 부품/소재,A066670,디스플레이텍,LCD모듈 전문제조업체. 삼성전자에 보급형 스마트폰용 LCD 모듈(LCM)을 ODM(제조자개발생산) 방식으로 납품.
3,LCD 부품/소재,A094970,제이엠티,"TFT-LCD 패널의 주요 부품 중 하나로 노트북 및 PC 모니터, LCD TV용 핵심 부품인 PBA(Printed Board Assembly)를 주력으로 생산, 공급하는 업체."
3,LCD 부품/소재,A155650,와이엠씨,"평판디스플레이(FPD) 부품 및 소재 제조업체. FPD(LCD, OLED) 제조공정 중 증착공정의 박막형성 및 FPD Panel 제조공정 중 증착공정에서 필요한 배선재의 재료인 타겟과 관련 부품인 Backing Plate, FPD공정장비 부품을 연구/개발/생산하는 사업 영위."
3,LCD 부품/소재,A051360,토비스,"중소형 TFT-LCD모듈을 생산/판매하고 있으며, LG전자가 주 고객임."
3,LCD 부품/소재,A006400,삼성SDI,"전자재료 사업부문에서 디스플레이에 사용되는 EMC, 편광필름, CR 등 디스플레이 관련 소재를 생산."
3,LCD 부품/소재,A178780,유테크,"모바일 디스플레이 부품 제조 및 판매업체. BLU 중에서 LED의 선광을 면광으로 전환하는 LGP(Light Guide Plate, 도광판)와 BLU 부품을 고정시키며 LED의 빛이 새는 것을 막아주는 M/F(Mold Frame, 몰드프레임)를 생산."
3,LCD 부품/소재,A144960,뉴파워프라즈마,"반도체 및 디스플레이(LCD, OLED, Solar 등) 박막공정 및 식각공정 장비에 사용되는 핵심 부품 공급 업체. 주요 제품으로는 박막공정 진행 후 공정내 잔존하는 부산물에 대한 Plasma Cleaning를 실시하는 핵심 모듈인 Remote Plasma Generator(RPG), 박막 공정이나 건식각 공정장비의 진공 방(Vacuum Chamber)에 가스를 공급하여 Plasma를 발생하는데 필요한 전원을 공급하는 모듈인 RF Generator(RFG) 및 Matcher(MAT) 등이 있음."
3,LCD 부품/소재,A090740,연이정보통신,"EMS(전자제품 생산전문기업) 전문업체. SMD(표면실장장치)와 SMT(표면실장기술)를 기반으로 TFT-LCD Monitor & Notebook용 Source PBA, LCD TV용 Control & Source PBA, LED용 PBA, OLED용 PBA를 주로 생산."
3,LCD 부품/소재,A114810,아이원스,"반도체 및 디스플레이(LCD, OLED) 관련 초정밀 가공/세정 업체."
3,LCD 부품/소재,A031330,에스에이엠티,"메모리를 포함한 각종 반도체 및 LCD 패널 등을 판매하고 있는 IT부품 유통업체. 삼성전자, 삼성디스플레이, 삼성전기, 삼성SDI 등의 IT기업들과 안정적인 공급계약을 체결하고, 스마트폰 및 디지탈카메라, TabletPC와 같은 IT 제품에 필요한 Memory, LCD패널, 시스템반도체, Digital Module 제품 등을 판매중."
3,LCD 부품/소재,A052420,오성첨단소재,광학용 보호/기능성 필름을 생산하는 소재사업을 영위. LCD용 기능성 광학필름 등을 생산중.
3,LCD 부품/소재,A149950,아바텍,LCD패널 식각 및 IPS패널 코팅 전문업체. 디스플레이 패널 Glass를 얇게 만드는 식각공정(LCD패널 Slimming)과 식각공정 후 고기능성 ITO코팅(LCD 패널중 Color 필터 상부에 ITO 도전막을 코팅) 수행.
3,LCD 부품/소재,A170920,엘티씨,디스플레이(LCD용)나 반도체 제조 공정에 사용되는 공정소재(Process Chemical) 중 하나인 박리액 개발 및 제조를 주력사업으로 영위. LCD용 박리액 매출비중이 높음.
3,LCD 부품/소재,A278280,천보,"디스플레이소재(LCD 식각액첨가제, OLED소재), 반도체 공정소재(SOH공정첨가제), 2차전지소재(전해질, 전해액 첨가제), 의약품 중간체(결핵치료제, 당뇨병치료제 등) 및 정밀화학 사업(질산 칼륨, 질산리튬 등) 등을 영위하는 업체. LCD식각액첨가제 아미노테트라졸(ATZ)은 국내시장점유율 1위, 세계시장점유율 1위(95%)를 차지하고 있으며, 차세대 제품인 메틸테트라졸(MTZ)도 판매."
3,LCD 부품/소재,A250930,예선테크,"기능성 점착소재 제조사업 영위업체. 주요 제품으로는 LCD 및 OLED TV, LCD 모니터 등에 쓰이는 Foam Pad, Gasket Pad, EFR Foam Pad, COF Pad 등."
30,조선,A009540,한국조선해양,"현대중공업, 현대삼호중공업, 현대미포조선 등을 종속회사로 보유한 현대중공업그룹 중간 지주회사."
30,조선,A010140,삼성중공업,"삼성그룹 계열의 대형 조선업체. 쇄빙유조선, LNG, 드릴쉽, 초대형컨테이너선, FPSO 등의 고부가가치 선박에 특화된 대형 조선사."
30,조선,A042660,대우조선해양,LNG선과 해양플랜트 부문에서 높은 경쟁력을 보유한 조선업체.
30,조선,A010620,현대미포조선,"현대중공업 계열의 중형선박전문 조선업체로 주력 선박은 석유화학제품 운반선과 중형 컨테이너운반선임. LPG/에틸렌 운반선, 자동차운반선, 냉동 컨테이너선, 컨-로(CON-RO)선, 아스팔트운반선, 해양작업지원선(PSV) 등 고부가 특수 선박시장에도 성공적으로 진출하는 등 선종 다변화를 통해 국제 경쟁력을 더욱 강화해 나가고 있음."
30,조선,A097230,한진중공업,"조선(신조선, 특수선, 수리선, 조선플랜트 등) 사업을 영위."
302,음성인식,A096610,알에프세미,ECM Chip(음성신호를 전기신호로 바꿔주는 초소형 반도체)을 마이크로폰 업체에 공급중.
302,음성인식,A091700,파트론,음성신호 전달 및 보이스 레코딩 기능을 하는 음성인식 분야 핵심 부품인 MEMS(Micro Electro Mechanical Systems) 마이크로폰 생산.
302,음성인식,A015710,코콤,음성으로 홈네트워크 주요 기능을 제어하는 월 패드 등을 개발해 상용화에 성공.
302,음성인식,A036690,코맥스,음성인식 알고리즘 엔진 및 음성인식 제어용 모듈 개발하여 홈네트워크 시스템에 적용.
302,음성인식,A039010,현대통신,SK하이닉스(구 하이닉스)에서 분사해 설립된 업체로 스마트홈시스템 사업 등을 영위. 음성으로 주요 기능을 제어하는 홈네트워크 기기 월패드 등을 개발해 상용화에 성공.
302,음성인식,A012330,현대모비스,음성인식 기능이 있는 AVN(오디오-비디오 내비게이션) 생산.
302,음성인식,A045970,코아시아,자회사 비에스이가 정보통신용 제품의 핵심부품인 마이크로폰 ECM(Electret Condenser Microphone)을 생산.
302,음성인식,A064480,브리지텍,"소프트웨어 개발 전문업체. 콜센터 솔루션 및 IP기반 유무선 멀티미디어 서비스, 클라우드 환경의 소프트웨어 임대사업 등을 영위. 주력사업은 콜센터 솔루션으로 금융권, 통신사, 공공기관, 지방자치단체, 기업체 등에 공급."
302,음성인식,A033560,블루콤,"블루투스 음성장치를 생산하고 있으며, 음성인식 소프트웨어 개발 및 공급업체 미디어젠 지분 보유."
302,음성인식,A038950,파인디지털,동사의 내비게이션에 한국전자통신연구원(ETRI)에서 개발한 음성인식 엔진을 결합함. 차량 전용 음성인식 기능과 블랙박스 연동 기능을 탑재한 매립 전용 내비게이션 출시.
302,음성인식,A035720,카카오,대화형 모바일 음성 검색 엔진을 개발. 2013년 음성인식 벤처기업 다이알로이드를 인수. 2017년11월 음성인식 인공지능 스피커 '카카오미니' 및 '18년9월 '카카오미니C' 출시.
302,음성인식,A035420,NAVER,"12년11월28일 온라인 음성인식을 처리하는 음성인식 클라이언트 시스템, 음성인식 서버 시스템 및 음성인식 방법 관련 특허권 취득. 음성인식 인공지능(AI) 플랫폼 클로바 서비스중."
302,음성인식,A078890,가온미디어,글로벌 유일 AI셋톱박스 제조 기업으로 KT의 'GIGA Genie'에 공급 중. 인공지능(AI) 음성비서 시장 확대에 따른 동사의 수혜 전망.
302,음성인식,A279600,미디어젠,"차량용 음성인식 전문 업체. 차량용 다국어 음성인식 플랫폼, 스마트 IoT 음성인식 플랫폼, 음성인식 평가 자동화 시스템, 음성인식 UX 평가 및 컨설팅 등의 기술을 통해 국내 주요 완성차 고객사(현대기아차 등)와 1차 벤더에 공급 중이며, 북미/일본/유럽의 자동차 메이커와 음성인식 고도화를 위한 각종 프로젝트를 수행 중."
307,시스템반도체,A036540,SFA반도체,"반도체 조립 및 TEST 제품을 주력으로 생산하는 반도체 후공정 전문업체. 과거 Low level 비메모리 반도체 생산에서 점차 경박단소, 적층, 고용량의 High-end 제품생산 및 SiP(System-in-Package), SSD용 부품 등 차세대 제품을 생산중."
307,시스템반도체,A033640,네패스,후공정 및 IT부품소재 전문업체. 비메모리 후공정(WLP) 및 Fan-out WLP(FOWLP) 기술을 보유중.
307,시스템반도체,A042700,한미반도체,"반도체, 태양광 및 LED 제조장비의 제조, 판매 업체. 반도체 제조용 장비를 국내외 반도체 관련 제조업체에 공급중. 반도체 후공정 장비업체로 시스템 반도체 투자 확대에 따른 수혜."
307,시스템반도체,A033170,시그네틱스,"영풍그룹의 계열의 반도체 패키징(테스트포함) 전문 업체. 독자개발 및 특허를 취득한 STBGA (signetics tape ball grid array) 양산체제를 구축. 또한, CSP 계열인 FBGA 제품과 eMCP제품 등을 수주하고, 첨단 신규 PKG 제품인 FLIPCHIP LINE을 증설하여 가동중. 신규 패키지 기술인 flip chip 패키징을 개발함으로서, 향후 매출증가의 기반을 마련. 주요 거래처는 삼성전자, SK하이닉스 등."
307,시스템반도체,A038880,아이에이,"비메모리 반도체 설계 전문기업. 자동차 전장 분야를 중심으로 사업을 전개중이며, 현대/기아차, 현대모비스, 현대오트론 등과 자동차용 비메모리 반도체 국산화 개발을 진행중. 이 외에도 멀티미디어 통신 및 ASIC(주문형반도체설계) 분야와 관련된 사업을 영위중."
307,시스템반도체,A003160,디아이,반도체 검사장비 등 초정밀 시험장비의 제조 및 수입업을 영위하는 업체. 삼성전자 향 시스템(비메모리) 반도체 검사장비 공급.
307,시스템반도체,A108320,실리콘웍스,"평판 디스플레이용 시스템 반도체 부품 제조업체. 생산설비가 없는 팹리스(Fabless)업체로 전량 반도체 전문생산업체(Foundry)에서 외주생산. 주요제품으로 다양한 방식의 디스플레이 구동에 필요한 핵심부품인 패널 구동 IC 와 Data 신호전달 및 제어부품(T-CON), 전원관리IC(PMIC) 등."
307,시스템반도체,A052860,아이앤씨,"팹리스(Fabless) 반도체 업체. 스마트에너지사업(한전 AMI, 민수 AMI, LED조명제어), 무선사업(IoT, Wi-Fi 칩&모듈), 멀티미디어사업(Mobile TV, Digital Radio)  등을 주요 사업으로 영위."
307,시스템반도체,A005930,삼성전자,"DS 사업부문(DRAM, NAND Flash, 모바일AP, TFT-LCD, OLED 등)에서 반도체 사업을 영위. 미국 오스틴의 시스템반도체(LSI) 전용라인을 보유. 신규 시스템반도체 라인인 화성 17라인을 보유."
307,시스템반도체,A000990,DB하이텍,"DB그룹 계열의 시스템 반도체 전문업체. 주요 사업으로 웨이퍼 수탁 생산 및 판매를 담당하는 Foundry 사업과 디스플레이 구동 및 Sensor IC 등 자사 제품을 설계, 판매하는 Brand 사업을 운영."
307,시스템반도체,A054450,텔레칩스,"디지털미디어 프로세서 등 멀티미디어와 통신관련 시장의 다양한 어플리케이션 제품에 필요한 핵심 칩 및 토탈솔루션을 개발/판매하는 비메모리 반도체 전문업체. 주요 제품으로 DMP(스마트 기기에 적용 되는 Application Processor 및 오디오/카메라/비디오 등 멀티미디어 기능을 지원하는 Digital Media Processor), Mobile TV 수신칩 등."
307,시스템반도체,A058470,리노공업,"검사용 PROBE(SPRING CONTACT PROBE:LEENO PIN)와 반도체 검사용 소켓(IC TEST SOCKET)을 자체브랜드로 개발하여, 제조 판매하는 사업을 영위하는 업체. 다품종 소량의 비메모리 반도체 칩에 대응할 수 있는 IC TEST SOCKET의 수요가 증가중."
307,시스템반도체,A062860,티엘아이,LCD 패널의 핵심부품인 Timing Controller와 LCD Driver IC등 시스템반도체 설계 전문 업체.
307,시스템반도체,A000660,SK하이닉스,"SK그룹 계열의 세계적인 메모리 반도체 전문 제조업체. 주력 생산제품은 DRAM과 낸드플래시 및 MCP(Multi-chip Package)와 같은 메모리 반도체 제품이나, 2007년부터는 시스템 LSI 분야인 CIS(CMOS Image Sensor) 사업에 재진출하여 종합반도체 회사로 영역을 확대중."
307,시스템반도체,A067310,하나마이크론,"삼성전자 반도체 부문에서 분사한 반도체(메모리/비메모리) 패키징 전문 업체. 반도체 산업의 후공정 분야인 반도체 조립 및 TEST 제품을 주력으로 생산하고 있으며, 삼성전자, SK하이닉스 등이 주요 거래처임."
307,시스템반도체,A092600,앤씨앤,영상보안장비에 특화된 멀티미디어 팹리스(Fabless) 반도체 설계업체. CCTV카메라와 DVR과 같은 영상보안기기의 영상처리 반도체를 주로 생산.
307,시스템반도체,A098460,고영,전자제품 및 반도체 생산용 검사장비업체(3차원 정밀측정 검사 기술 보유). 주요 제품으로 3D SPI 장비와 3D AOI 장비 등을 보유.
307,시스템반도체,A101490,에스앤에스텍,"블랭크 마스크 제조업체. 블랭크마스크는 반도체 및 LCD, OLED 노광 공정의 핵심재료인 포토마스크의 원재료임. 시스템반도체 육성에 따른 블랭크마스크 매출 증가 기대."
307,시스템반도체,A102120,어보브반도체,"비메모리 반도체 중 주로 가전/전기 제품의 두뇌역할을 하는 반도체 칩(Microcontroller Unit) 생산/설계 팹리스 업체. 삼성 및 LG, 위니아대우 등 국내 가전사를 비롯하여 중국의 Midea, Xiaomi 등에 제품을 공급중."
307,시스템반도체,A117670,알파홀딩스,"시스템반도체 개발 전문기업. 다양한 분야(모바일, 자동차, CCTV 등)에서 시스템반도체 제품을 설계하는 팹리스 회사에 IP 및 개발에 필요한 모든 솔루션을 제공중. 삼성전자와 디자인서비스 Partner 계약을 체결하여 팹리스 회사에 완성된 시스템반도체 제품을 공급중. 제품 생산은 삼성전자에 위탁생산을 진행."
307,시스템반도체,A119830,아이텍,시스템 반도체 테스트 전문업체. 패키지테스트(조립이 완료된 반도체에 대한 최종 양품/불량 판정 테스트)와 웨이퍼테스트(Fab에서 나온 Wafer를 조립진행 전 양품/불량 판정 테스트)를 주요사업으로 영위.
307,시스템반도체,A123860,아나패스,"비메모리 반도체의 일종인 시스템 반도체 특히, 주문형 반도체(ASIC)를 주력으로 개발, 공급하는 팹리스 업체. 주력제품으로 타이밍콘트롤러(T-con)를 개발/생산하고 있으며, 주 매출처로는 삼성디스플레이, SEC 등."
307,시스템반도체,A089530,에이티세미콘,"반도체(메모리 및 시스템 반도체) 패키징 사업 및 테스트사업을 영위하는 반도체 후공정업체. 주거래처는 삼성전자와 SK하이닉스 등 대형 IDM 업체와 일본의 후지쯔, 샤프 등 해외 팹리스 업체."
307,시스템반도체,A080520,오디텍,"반도체제조공정(FAB)을 바탕으로 비메모리반도체 Chip과 센서 및 센서모듈, 시스템의 수직계열화된 제품을 생산."
307,시스템반도체,A131970,테스나,"시스템반도체 테스트 전문업체. Logic 및 Mixed Signal IC를 포함한 SoC, CMOS 이미지센서(CIS), Micro Controller/Smart Card IC 및 Analog 반도체 테스트를 주요 사업 영역으로 영위."
307,시스템반도체,A059120,아진엑스텍,"모션제어 칩을 핵심경쟁력으로 하는 Fab-less 반도체 설계 전문업체. 모션제어 칩(Chip)을 이용해 다양한 모션제어 모듈, 모션제어 시스템, 로봇제어기 제품을 자체 기술로 개발/제조/판매/서비스중. 반도체 장비 및 스마트폰 장비와 같은 제조/검사 자동화 장비의 제어기 국산화 및 제조용 로봇제어기 전문기업."
307,시스템반도체,A200710,에이디테크놀로지,"반도체소자 설계 및 제조(ASIC)를 주요사업으로 영위. 세계 최고 파운드리 기업인 TSMC로부터 VCA(Value Chain Aggregator)로 지정. 고사양/고집적도 시스템 반도체를 개발 및 양산중이며, 저전력 시스템반도체 개발을 위한 인프라를 확보하고 있음."
307,시스템반도체,A061970,엘비세미콘,평판 디스플레이용 Driver IC(DDI) 및 CMOS Image Sensor(CIS) 등 비메모리반도체의 범핑(Bumping) 및 패키징(Packaging) 사업을 영위.
307,시스템반도체,A093640,다믈멀티미디어,"소비자(Consumer)용 멀티미디어 반도체를 개발, 판매하는 기능형 반도체 설계전문회사. SoC(System On a Chip) 설계기술을 바탕으로 Optical IC 및 Multimedia Interface IC 등의 제품을 개발 및 판매. AP(어플리케이션 프로세서) IC와 DAB IC 등의 제품도 개발."
307,시스템반도체,A054630,에이디칩스,반도체 설계 및 비메모리 반도체 판매 업체로 EISC MCU Core IP 라이센싱 사업과 ASSP 개발/판매 및 이를 이용한 보드/시스템 개발/판매 사업 영위. 엠코어(emCORE) 소프트 설계자산이 삼성전자 시스템LSI 파운드리사업부의 파운드리 서비스 목록에 등재.
307,시스템반도체,A089030,테크윙,"반도체 테스트핸들러 장비 전문 기업. 메모리 테스트핸들러 장비 기술 경쟁력 기반, 비메모리 테스트핸들러 장비 시장으로 사업 확대."
307,시스템반도체,A319660,피에스케이,"기존 피에스케이에서 반도체 전공정 장비 사업부문이 인적분할됨에 따라 재상장된 업체. 주요 제품으로 Dry Strip, WLP Descum, Dry Cleaning, Etch Back 등이 있으며, 특히 주력 제품인 Dry Strip 장비는 글로벌 시장 1위임. 메모리반도체 시장 內 점유율 확대시키며 시장 성장에 따른 수혜 기대감 부각."
307,시스템반도체,A303030,지니틱스,"시스템 반도체 팹리스 설계 회사로, 시스템 반도체의 가장 기본이 되며 핵심인 터치 컨트롤러 IC(Touch Controller IC), Auto Focus & OIS Driver IC (‘AF Driver IC’), Haptic IC, Fintech MST IC, AMOLED DC-DC IC 등을 개발."
307,시스템반도체,A317120,라닉스,자동차와 사물인터넷(IoT)의 핵심기술인 무선통신과 보안 및 인증 관련 시스템반도체 및 LPWAN(Low-Power Wide-Area Network) 플랫폼 사업 등을 영위하는 토털 시스템반도체 솔루션 업체.
31,환율하락 수혜,A005880,대한해운,"철광석, 석탄, 천연가스 원유 등의 에너지 및 자원을 전문적으로 수송하는 대표적인 벌크선사로 LNG선, 탱커선, 컨테이너선 등의 해운업 영위업체. 환율하락시 선박유 비용절감 효과로 수혜주로 부각됨."
31,환율하락 수혜,A097950,CJ제일제당,"국내 최대 종합식품업체로 원재료(원당, 원맥, 대두) 수입 비중이 높아 환율하락시 수혜주로 부각."
31,환율하락 수혜,A000070,삼양홀딩스,"삼양그룹 계열의 지주회사로 삼양사(식품, 화학 등 영위), 삼양바이오팜, 삼남석유화학 등의 7개 자회사를 보유. 자회사들의 원재료(원당, 옥수수 등) 수입 비중이 높아 환율하락시 수혜주로 부각됨."
31,환율하락 수혜,A001130,대한제분,제분업 및 소맥분 판매업 등을 주요사업으로 영위하고 있는 업체. 원재료(원맥 등) 수입 비중이 높아 환율하락시 수혜주로 부각.
31,환율하락 수혜,A001230,동국제강,"판재류(후판)과 봉형강류(철근, 형강) 등을 생산하는 철강제조 전문업체. 원재료(수입고철, 선철, SLAB 등) 수입 비중이 높아 환율하락시 수혜주로 부각."
31,환율하락 수혜,A001680,대상,"종합식품사업 및 소재사업을 영위하는 식품 전문 업체. 원재료(옥수수, 원당, 당밀 등) 수입 비중이 높아 환율하락시 수혜주로 부각."
31,환율하락 수혜,A001790,대한제당,"제당사업(설탕 등) 및 사료사업(가축용 배합사료)을 영위하는 음식료품 제조업체. 원재료(원당, 옥수수, 코코아 등) 수입 비중이 높아 환율하락시 수혜주로 부각."
31,환율하락 수혜,A002300,한국제지,"인쇄용지 제조 및 판매업체. 백상지, 복사지, 아트지, 특수지 등의 인쇄용지 제조 및 판매를 주요사업으로 영위. 원재료(펄프, LATEX 등) 수입 비중이 높아 환율하락시 수혜주로 부각됨."
31,환율하락 수혜,A003010,혜인,"건설기계 및 육상용 발전기, 선박 및 산업용 엔진/발전기 수입판매 전문업체. 세계 최대의 중장비 제조업체인 美 캐터필러를 비롯해 Metso, Jungheinrich, Vermeer 社의 한국내 독점 딜러 및 대리점으로서 캐터필러 제품의 매출 비중이 높음. 수입판매 비중이 높아 환율하락시 수혜주로 부각됨."
31,환율하락 수혜,A103140,풍산,"비철금속의 소재(동 및 동합금 판/대, 관, 봉/선, 소전 등)를 제조, 판매하는 신동사업을 영위. 원재료(전기동, 아연, 니켈 등) 수입 비중이 높아 환율하락시 수혜주로 부각됨."
31,환율하락 수혜,A003490,대한항공,한진그룹 계열의 국내 최대 항공운송회사. 항공기 리스계약이 외화로 이루어지기 때문에 환율이 하락하면 원화로 환산한 차입금이 줄어 부채비율이 개선되는 효과 발생.
31,환율하락 수혜,A004020,현대제철,"현대자동차계열로 H형강, 철근 부문에서 국내 최대의 전기로 제강업체. 원재료(철광석, 석탄 등) 수입 비중이 높아 환율하락시 수혜주로 부각됨."
31,환율하락 수혜,A004370,농심,"국내 최대의 라면 생산업체. 라면(신라면, 너구리, 안성탕면 등), 스낵(새우깡 등) 등의 사업 영위. 원재료(소맥, 팜유 등) 수입비중이 높아 환율하락시 수혜주로 부각."
31,환율하락 수혜,A005490,POSCO,"국내 철강시장에서의 독점적 지위와 세계적인 경쟁력을 보유하고 있는 종합제철업체. 원재료(철강석, 석탄, STS원료 등) 수입비중이 높아 환율하락시 수혜주로 부각."
31,환율하락 수혜,A007310,오뚜기,"식품 전문업체로 마요네즈, 케찹, 카레, 식초, 3분류, 라면, 참기름, 참치 등 생산. 원재료(팜유 등) 수입 비중이 높아 환율하락시 수혜주로 부각됨."
31,환율하락 수혜,A010130,고려아연,"세계적인 비철금속 제련업체로 아연과 연의 생산판매를 주력으로 하며, 금, 은, 황산등은 아연과 연 제련과정에서 회수하는 유가금속과 부산물의 일종으로 생산. 원재료(아연정광, 연정광 등) 수입 비중이 높아 환율하락시 수혜주로 부각."
31,환율하락 수혜,A015760,한국전력,"국내 발전 및 송전사업을 책임지고 있는 공기업으로 전기판매, 원자력발전, 화력발전, 기타(발전소 설계 및 정비 등)사업을 영위. 유연탄, LNG 등의 연료가 대부분 환율 변동에 노출되어 있어 환율하락시 수혜주로 분류됨."
31,환율하락 수혜,A020560,아시아나항공,금호아시아나 그룹 계열의 국내 메이저 항공운송회사. 항공기 리스계약이 외화로 이뤄져 환율 하락시 원화 환산한 차입금이 줄어 부채비율 개선 효과가 발생.
